ad_id,publisher_id,type,location,purpose,price,title,description
43,100394,residence,Πάτρα,buy,50000,Διαμέρισμα 52 τ.μ.,ΚΩΔΙΚΟΣ ΑΚΙΝΗΤΟΥ: 22657 | ΠΑΤΡΑ ΠΑΠΑΦΛΕΣΣΑ: ΠΩΛΕΙΤΑΙ ΔΙΑΜΠΕΡΕΣ ΔΙΑΜΕΡΙΣΜΑ 52Τ.Μ. ΠΡΟΣΟΨΕΩΣ ΣΕ ΗΜΙΩΡΟΦΟ. ΑΠΟΤΕΛΕΙΤΑΙ ΑΠΟ 1 ΥΠΝΟΔΩΜΑΤΙΟ 1 ΚΟΥΖΙΝΑ 1 ΣΑΛΟΝΙ ΚΑΙ ΜΠΑΝΙΟ. ΕΙΝΑΙ ΚΑΤΑΣΚΕΥΑΣΜΕΝΟ ΤΟ 1981 ΚΑΙ ΔΙΑΘΕΤΕΙ ΚΟΥΦΩΜΑΤΑ ΑΛΟΥΜΙΝΙΟΥ ΜΕ ΔΙΠΛΑ ΤΖΑΜΙΑ ΚΛΙΜΑΤΙΣΜΟ ΔΑΠΕΔΑ ΑΠΟ ΜΑΡΜΑΡΟ ΣΙΤΕΣ. ΤΟ ΑΚΙΝΗΤΟ ΠΡΟΤΕΙΝΕΤΑΙ ΩΣ ΕΠΕΝΔΥΤΙΚΟ. ΕΙΝΑΙ ΙΔΑΝΙΚΟ ΓΙΑ ΦΟΙΤΗΤΕΣ. ΕΠΙΠΛΕΟΝ ΧΑΡΑΚΤΗΡΙΣΤΙΚΑ: ΠΑΤΑΡΙ ΑΠΟΘΗΚΕΥΣΗΣ.     ΤΙΜΗ 50.000€ | ΚΩΔΙΚΟΣ ΑΚΙΝΗΤΟΥ: 22657 ΑΚΙΝΗΤΑ ΑΠΟΚΛΕΙΣΤΙΚΗΣ ΔΙΑΘΕΣΗΣ ΜΕ ΦΩΤΟΓΡΑΦΙΕΣ ΠΟΥ ΔΙΑΧΕΙΡΙΖΕΤΑΙ Η ΕΤΑΙΡΙΑ ΜΑΣ ΘΑ ΒΡΕΙΤΕ ΣΤΗΝ ΙΣΤΟΣΕΛΙΔΑ ΜΑΣ. WEBSITE: www.tzelirealestate.gr ΓΙΑ ΤΗΝ ΚΑΛΥΤΕΡΗ ΕΞΥΠΗΡΕΤΗΣΗ ΣΑΣ ΧΡΗΣΙΜΟΠΟΙΕΙΣΤΕ ΤΟΝ ΚΩΔΙΚΟ ΑΚΙΝΗΤΟΥ ΠΟΥ ΑΝΑΓΡΑΦΕΤΑΙ ΣΤΗΝ ΠΕΡΙΓΡΑΦΗ. Η ΔΙΕΥΘΥΝΣΗ ΣΤΟΝ ΧΑΡΤΗ ΕΧΕΙ ΤΟΠΟΘΕΤΗΘΕΙ ΚΑΤΑ ΠΡΟΣΕΓΓΙΣΗ. ΟΙ ΑΚΡΙΒΕΙΣ ΠΛΗΡΟΦΟΡΙΕΣ ΤΗΣ ΔΙΕΥΘΥΝΣΗΣ ΠΑΡΕΧΟΝΤΑΙ ΣΤΗΝ ΥΠΟΔΕΙΞΗ ΤΟΥ ΑΚΙΝΗΤΟΥ.
44,100267,residence,Πάτρα,buy,300000,Μονοκατοικία 160 τ.μ.,
45,100030,residence,Πάτρα,buy,95000,Διαμέρισμα 80 τ.μ.,ΚΩΔΙΚΟΣ ΑΚΙΝΗΤΟΥ: 5319 | ΠΑΤΡΑ ΖΑΡΟΥΧΛΕΙΚΑ: ΠΩΛΕΙΤΑΙ ΑΝΑΚΑΙΝΙΣΜΕΝΟ ΔΙΑΜΠΕΡΕΣ ΔΙΑΜΕΡΙΣΜΑ 80Τ.Μ. ΠΡΟΣΟΨΕΩΣ ΣΤΟΝ 3Ο ΟΡΟΦΟ ΜΕ ΑΥΤΟΝΟΜΗ ΘΕΡΜΑΝΣΗ FAN COIL. ΑΠΟΤΕΛΕΙΤΑΙ ΑΠΟ 2 ΥΠΝΟΔΩΜΑΤΙΑ 1 ΚΟΥΖΙΝΑ 1 ΣΑΛΟΝΙ ΚΑΙ ΜΠΑΝΙΟ. ΕΙΝΑΙ ΚΑΤΑΣΚΕΥΑΣΜΕΝΟ ΤΟ 1985 ΒΑΜΜΕΝΟ ΚΑΙ ΔΙΑΘΕΤΕΙ ΩΡΑΙΑ ΘΕΑ ΚΟΥΦΩΜΑΤΑ ΑΛΟΥΜΙΝΙΟΥ ΜΕ ΔΙΠΛΑ ΤΖΑΜΙΑ ΕΞΩΤΕΡΙΚΗ (ΚΑΛΥΜΜΕΝΗ) ΘΕΣΗ ΣΤΑΘΜΕΥΣΗΣ ΚΛΙΜΑΤΙΣΜΟ ΕΝΕΡΓΕΙΑΚΗ ΚΛΑΣΗ Γ ΔΑΠΕΔΑ ΑΠΟ ΠΛΑΚΑΚΙ ΝΥΧΤΕΡΙΝΟ ΡΕΥΜΑ ΤΕΝΤΕΣ ΣΙΤΕΣ ΗΛΙΑΚΟ ΘΕΡΜΟΣΙΦΩΝΑ. ΤΟ ΑΚΙΝΗΤΟ ΠΡΟΤΕΙΝΕΤΑΙ ΩΣ ΕΠΕΝΔΥΤΙΚΟ. ΕΙΝΑΙ ΙΔΑΝΙΚΟ ΓΙΑ ΦΟΙΤΗΤΕΣ Η ΟΙΚΟΓΕΝΕΙΕΣ Η ΕΡΓΑΖΟΜΕΝΟΥΣ ΧΩΡΙΣ ΜΗΝΙΑΙΑ ΚΟΙΝΟΧΡΗΣΤΑ ΚΑΙ ΕΠΙΤΡΕΠΟΝΤΑΙ ΤΑ ΚΑΤΟΙΚΙΔΙΑ. ΤΙΜΗ 95.000€   | ΚΩΔΙΚΟΣ ΑΚΙΝΗΤΟΥ: 5319 ΟΛΑ ΤΑ ΑΚΙΝΗΤΑ ΠΟΥ ΕΧΕΙ ΑΝΑΛΑΒΕΙ ΤΟ ΓΡΑΦΕΙΟ ΜΑΣ ΜΠΟΡΕΙΤΕ ΝΑ ΤΑ ΒΡΕΙΤΕ ΣΥΓΚΕΝΤΡΩΜΕΝΑ ΣΤΟ SITE ΜΑΣ: WWW.NUEVACASA.ESTATE Η ΚΟΥΚΚΙΔΑ ΣΤΟΥΣ ΧΑΡΤΕΣ ΤΟΠΟΘΕΤΕΙΤΑΙ ΚΑΤΑ ΠΡΟΣΕΓΓΙΣΗ Η ΑΚΡΙΒΗΣ ΔΙΕΥΘΥΝΣΗ ΤΟΥ ΑΚΙΝΗΤΟΥ ΔΙΝΕΤΑΙ ΚΑΤΟΠΙΝ ΥΠΟΓΡΑΦΗΣ ΤΗΣ ΕΝΤΟΛΗΣ ΥΠΟΔΕΙΞΕΩΣ ΑΥΤΟΥ ΜΕΣΙΤΙΚΟ ΓΡΑΦΕΙΟ «NUEVA CASA» ΔΙΕΥΘΥΝΣΗ: ΠΑΝΤΑΝΑΣΣΗΣ 53 ΠΑΤΡΑ WEBSITE: WWW.NUEVACASA.ESTATE E-MAIL: NUEVA_CASA@OUTLOOK.COM ΤΗΛ. ΕΠΙΚΟΙΝΩΝΙΑΣ: 2614 010 635 ΚΙΝΗΤΟ: 6909 569 549
46,100237,residence,Πάτρα,buy,330000,Μεζονέτα 225 τ.μ.,Πάτρα Καστελλόκαμπος: Πωλείται γωνιακή Μεζονέτα 225τ.μ. πολυτελείας προσόψεως σε ισόγειο 3 επιπέδων με αυτόνομη θέρμανση πετρελαίου. Αποτελείται από 4 υπνοδωμάτια 1 σαλονοκουζίνα 2 κουζίνες 1 σαλόνι Κήπο 2 μπάνια και 1 WC. Είναι με ηλεκτρικές συσκευές κατασκευασμένη το 2009 βαμμένη και διαθέτει θέα στη θάλασσα εσωτερικό ασανσέρ κουφώματα αλουμινίου με διπλά τζάμια θωρακισμένη πόρτα εσωτερική θέση στάθμευσης κλιματισμό ενεργειακή κλάση Γ δάπεδα από μάρμαρο τζάκι τέντες συναγερμό ηλιακό θερμοσίφωνα playroom. Το ακίνητο έχει την παρακάτω διαρρύθμιση χώρων: 80 ισογειο 80 1ος 65 ημιυπόγειο Είναι ιδανική για οικογένειες ή εργαζόμενους χωρίς μηνιαία κοινόχρηστα και επιτρέπονται τα κατοικίδια. Επιπλέον χαρακτηριστικά: Έτοιμο προς αγορά. Τιμή 330.000€ | Κωδικός Ακινήτου: 14061 Το στίγμα στον χάρτη είναι ενδεικτικό και αποτυπώνει την ευρύτερη περιοχή. ATALLAS (GREEK COAST) REAL ESTATE Τηλέφωνο Επικοινωνίας: (+30) 2610222005 (+30) 2610424008 Διεύθυνση: Κορίνθου 162 Πάτρα 26223 Ιστοσελίδα: www.greekcoast.gr
47,100127,residence,Οβριά,buy,220000,Μεζονέτα 135 τ.μ.,ΚΩΔΙΚΟΣ ΑΚΙΝΗΤΟΥ: 22732 | ΠΑΤΡΑ ΜΕΤΑΜΟΡΦΩΣΗ: ΠΩΛΕΙΤΑΙ ΝΕΟΔΜΗΤΗ ΔΙΑΜΠΕΡΗΣ ΜΕΖΟΝΕΤΑ 135Τ.Μ. ΠΡΟΣΟΨΕΩΣ ΣΕ ΙΣΟΓΕΙΟ 2 ΕΠΙΠΕΔΩΝ ΜΕ ΑΥΤΟΝΟΜΗ ΘΕΡΜΑΝΣΗ ΠΕΤΡΕΛΑΙΟΥ. ΑΠΟΤΕΛΕΙΤΑΙ ΑΠΟ 4 ΥΠΝΟΔΩΜΑΤΙΑ ΕΚ ΤΩΝ ΟΠΟΙΩΝ ΤΟ 1 ΕΙΝΑΙ ΣΤΟ ΙΣΟΓΕΙΟ ΚΑΙ ΕΧΕΙ ΤΗΝ ΧΡΗΣΗ ΞΕΝΩΝΑ 1 ΚΟΥΖΙΝΑ 1 ΣΑΛΟΝΙ ΚΗΠΟ ΑΠΟΘΗΚΗ ΚΑΙ 3 ΜΠΑΝΙΑ. ΕΙΝΑΙ ΠΛΗΡΩΣ ΕΠΙΠΛΩΜΕΝΗ ΕΞΟΠΛΙΣΜΕΝΗ ΜΕ ΗΛΕΚΤΡΙΚΕΣ ΣΥΣΚΕΥΕΣ ΚΑΤΑΣΚΕΥΑΣΜΕΝΗ ΤΟ 2007 ΒΑΜΜΕΝΗ ΚΑΙ ΔΙΑΘΕΤΕΙ ΚΟΥΦΩΜΑΤΑ ΑΛΟΥΜΙΝΙΟΥ ΜΕ ΔΙΠΛΑ ΤΖΑΜΙΑ ΠΟΡΤΑ ΑΣΦΑΛΕΙΑΣ ΕΞΩΤΕΡΙΚΗ ΘΕΣΗ ΣΤΑΘΜΕΥΣΗΣ ΚΛΙΜΑΤΙΣΜΟ ΔΑΠΕΔΑ ΑΠΟ ΠΛΑΚΑΚΙ ΤΖΑΚΙ ΤΕΝΤΕΣ ΣΙΤΕΣ ΣΥΝΑΓΕΡΜΟ ΗΛΙΑΚΟ ΘΕΡΜΟΣΙΦΩΝΑ. ΤΟ ΑΚΙΝΗΤΟ ΕΧΕΙ ΤΗΝ ΠΑΡΑΚΑΤΩ ΔΙΑΡΡΥΘΜΙΣΗ ΧΩΡΩΝ: ΙΣΟΓΕΙΟ ΠΡΩΤΟΣ ΟΡΟΦΟΣ. ΕΙΝΑΙ ΙΔΑΝΙΚΗ ΓΙΑ ΟΙΚΟΓΕΝΕΙΕΣ. ΕΠΙΠΛΕΟΝ ΧΑΡΑΚΤΗΡΙΣΤΙΚΑ: ΑΥΛΗ ΘΥΡΟΤΗΛΕΟΡΑΣΗ ΜΠΟΙΛΕΡ ΠΑΤΑΡΙ ΑΠΟΘΗΚΕΥΣΗΣ.     ΤΙΜΗ 220.000€ | ΚΩΔΙΚΟΣ ΑΚΙΝΗΤΟΥ: 22732 ΑΚΙΝΗΤΑ ΑΠΟΚΛΕΙΣΤΙΚΗΣ ΔΙΑΘΕΣΗΣ ΜΕ ΦΩΤΟΓΡΑΦΙΕΣ ΠΟΥ ΔΙΑΧΕΙΡΙΖΕΤΑΙ Η ΕΤΑΙΡΙΑ ΜΑΣ ΘΑ ΒΡΕΙΤΕ ΣΤΗΝ ΙΣΤΟΣΕΛΙΔΑ ΜΑΣ. WEBSITE: www.tzelirealestate.gr ΓΙΑ ΤΗΝ ΚΑΛΥΤΕΡΗ ΕΞΥΠΗΡΕΤΗΣΗ ΣΑΣ ΧΡΗΣΙΜΟΠΟΙΕΙΣΤΕ ΤΟΝ ΚΩΔΙΚΟ ΑΚΙΝΗΤΟΥ ΠΟΥ ΑΝΑΓΡΑΦΕΤΑΙ ΣΤΗΝ ΠΕΡΙΓΡΑΦΗ. Η ΔΙΕΥΘΥΝΣΗ ΣΤΟΝ ΧΑΡΤΗ ΕΧΕΙ ΤΟΠΟΘΕΤΗΘΕΙ ΚΑΤΑ ΠΡΟΣΕΓΓΙΣΗ. ΟΙ ΑΚΡΙΒΕΙΣ ΠΛΗΡΟΦΟΡΙΕΣ ΤΗΣ ΔΙΕΥΘΥΝΣΗΣ ΠΑΡΕΧΟΝΤΑΙ ΣΤΗΝ ΥΠΟΔΕΙΞΗ ΤΟΥ ΑΚΙΝΗΤΟΥ.
48,100394,residence,Πάτρα,buy,90000,Διαμέρισμα 120 τ.μ.,ΚΩΔΙΚΟΣ ΑΚΙΝΗΤΟΥ: 22721 | ΠΑΤΡΑ ΜΕΤΑΜΟΡΦΩΣΗ: ΠΩΛΕΙΤΑΙ ΔΙΑΜΠΕΡΕΣ ΔΙΑΜΕΡΙΣΜΑ 120Τ.Μ. ΠΡΟΣΟΨΕΩΣ ΣΤΟΝ 1 ΟΡΟΦΟ. ΑΠΟΤΕΛΕΙΤΑΙ ΑΠΟ 3 ΥΠΝΟΔΩΜΑΤΙΑ ΕΚ ΤΩΝ ΟΠΟΙΩΝ ΤΟ 1 ΕΙΝΑΙ MASTER 1 ΚΟΥΖΙΝΑ 1 ΣΑΛΟΝΙ ΚΑΙ 2 ΜΠΑΝΙΑ. ΕΙΝΑΙ ΚΑΤΑΣΚΕΥΑΣΜΕΝΟ ΤΟ 1987 ΚΑΙ ΔΙΑΘΕΤΕΙ ΚΟΥΦΩΜΑΤΑ ΑΛΟΥΜΙΝΙΟΥ ΜΕ ΔΙΠΛΑ ΤΖΑΜΙΑ ΔΑΠΕΔΑ ΑΠΟ ΠΛΑΚΑΚΙ ΚΑΙ ΣΙΤΕΣ. ΕΙΝΑΙ ΙΔΑΝΙΚΟ ΓΙΑ ΟΙΚΟΓΕΝΕΙΕΣ ΧΩΡΙΣ ΜΗΝΙΑΙΑ ΚΟΙΝΟΧΡΗΣΤΑ. ΕΠΙΠΛΕΟΝ ΧΑΡΑΚΤΗΡΙΣΤΙΚΑ: ΗΛΕΚΤΡΙΚΑ ΡΟΛΑ ΠΑΤΑΡΙ ΑΠΟΘΗΚΕΥΣΗΣ.     ΤΙΜΗ 90.000€ | ΚΩΔΙΚΟΣ ΑΚΙΝΗΤΟΥ: 22721 ΑΚΙΝΗΤΑ ΑΠΟΚΛΕΙΣΤΙΚΗΣ ΔΙΑΘΕΣΗΣ ΜΕ ΦΩΤΟΓΡΑΦΙΕΣ ΠΟΥ ΔΙΑΧΕΙΡΙΖΕΤΑΙ Η ΕΤΑΙΡΙΑ ΜΑΣ ΘΑ ΒΡΕΙΤΕ ΣΤΗΝ ΙΣΤΟΣΕΛΙΔΑ ΜΑΣ. WEBSITE: www.tzelirealestate.gr ΓΙΑ ΤΗΝ ΚΑΛΥΤΕΡΗ ΕΞΥΠΗΡΕΤΗΣΗ ΣΑΣ ΧΡΗΣΙΜΟΠΟΙΕΙΣΤΕ ΤΟΝ ΚΩΔΙΚΟ ΑΚΙΝΗΤΟΥ ΠΟΥ ΑΝΑΓΡΑΦΕΤΑΙ ΣΤΗΝ ΠΕΡΙΓΡΑΦΗ. Η ΔΙΕΥΘΥΝΣΗ ΣΤΟΝ ΧΑΡΤΗ ΕΧΕΙ ΤΟΠΟΘΕΤΗΘΕΙ ΚΑΤΑ ΠΡΟΣΕΓΓΙΣΗ. ΟΙ ΑΚΡΙΒΕΙΣ ΠΛΗΡΟΦΟΡΙΕΣ ΤΗΣ ΔΙΕΥΘΥΝΣΗΣ ΠΑΡΕΧΟΝΤΑΙ ΣΤΗΝ ΥΠΟΔΕΙΞΗ ΤΟΥ ΑΚΙΝΗΤΟΥ.
49,100005,residence,Πάτρα,buy,70000,Διαμέρισμα 70 τ.μ.,ΚΩΔΙΚΟΣ ΑΚΙΝΗΤΟΥ: 22746 | ΠΑΤΡΑ ΠΑΤΡΑ - ΚΕΝΤΡΟ: ΠΩΛΕΙΤΑΙ ΜΕΡΙΚΩΣ ΑΝΑΚΑΙΝΙΣΜΕΝΟ ΔΙΑΜΠΕΡΕΣ ΔΙΑΜΕΡΙΣΜΑ 70Τ.Μ. ΠΡΟΣΟΨΕΩΣ ΣΤΟΝ 5 ΟΡΟΦΟ ΜΕ ΑΣΑΝΣΕΡ ΜΕ ΚΕΝΤΡΙΚΗ ΘΕΡΜΑΝΣΗ ΠΕΤΡΕΛΑΙΟΥ. ΑΠΟΤΕΛΕΙΤΑΙ ΑΠΟ 2 ΥΠΝΟΔΩΜΑΤΙΑ 1 ΚΟΥΖΙΝΑ 1 ΣΑΛΟΝΙ ΚΑΙ ΜΠΑΝΙΟ. ΕΙΝΑΙ ΚΑΤΑΣΚΕΥΑΣΜΕΝΟ ΤΟ 1990 ΚΑΙ ΔΙΑΘΕΤΕΙ ΩΡΑΙΑ ΘΕΑ ΚΟΥΦΩΜΑΤΑ ΑΛΟΥΜΙΝΙΟΥ ΠΟΡΤΑ ΑΣΦΑΛΕΙΑΣ ΔΑΠΕΔΑ ΑΠΟ ΠΛΑΚΑΚΙ. ΤΟ ΑΚΙΝΗΤΟ ΠΡΟΤΕΙΝΕΤΑΙ ΩΣ ΕΠΕΝΔΥΤΙΚΟ. ΕΙΝΑΙ ΙΔΑΝΙΚΟ ΓΙΑ ΦΟΙΤΗΤΕΣ ΜΕ ΕΛΑΧΙΣΤΑ ΚΟΙΝΟΧΡΗΣΤΑ. ΕΠΙΠΛΕΟΝ ΧΑΡΑΚΤΗΡΙΣΤΙΚΑ: ΠΑΤΑΡΙ ΑΠΟΘΗΚΕΥΣΗΣ.     ΤΙΜΗ 70.000€ | ΚΩΔΙΚΟΣ ΑΚΙΝΗΤΟΥ: 22746 ΑΚΙΝΗΤΑ ΑΠΟΚΛΕΙΣΤΙΚΗΣ ΔΙΑΘΕΣΗΣ ΜΕ ΦΩΤΟΓΡΑΦΙΕΣ ΠΟΥ ΔΙΑΧΕΙΡΙΖΕΤΑΙ Η ΕΤΑΙΡΙΑ ΜΑΣ ΘΑ ΒΡΕΙΤΕ ΣΤΗΝ ΙΣΤΟΣΕΛΙΔΑ ΜΑΣ. WEBSITE: www.tzelirealestate.gr ΓΙΑ ΤΗΝ ΚΑΛΥΤΕΡΗ ΕΞΥΠΗΡΕΤΗΣΗ ΣΑΣ ΧΡΗΣΙΜΟΠΟΙΕΙΣΤΕ ΤΟΝ ΚΩΔΙΚΟ ΑΚΙΝΗΤΟΥ ΠΟΥ ΑΝΑΓΡΑΦΕΤΑΙ ΣΤΗΝ ΠΕΡΙΓΡΑΦΗ. Η ΔΙΕΥΘΥΝΣΗ ΣΤΟΝ ΧΑΡΤΗ ΕΧΕΙ ΤΟΠΟΘΕΤΗΘΕΙ ΚΑΤΑ ΠΡΟΣΕΓΓΙΣΗ. ΟΙ ΑΚΡΙΒΕΙΣ ΠΛΗΡΟΦΟΡΙΕΣ ΤΗΣ ΔΙΕΥΘΥΝΣΗΣ ΠΑΡΕΧΟΝΤΑΙ ΣΤΗΝ ΥΠΟΔΕΙΞΗ ΤΟΥ ΑΚΙΝΗΤΟΥ.
50,100400,residence,Πάτρα,buy,75000,Διαμέρισμα 62 τ.μ.,ΚΩΔΙΚΟΣ ΑΚΙΝΗΤΟΥ: 22753 | ΠΑΤΡΑ ΣΚΑΓΙΟΠΟΥΛΕΙΟ: ΠΩΛΕΙΤΑΙ ΠΛΗΡΩΣ ΑΝΑΚΑΙΝΙΣΜΕΝΟ ΔΙΑΜΠΕΡΕΣ ΔΙΑΜΕΡΙΣΜΑ 62Τ.Μ. ΠΡΟΣΟΨΕΩΣ ΣΤΟΝ 4 ΟΡΟΦΟ ΜΕ ΑΣΑΝΣΕΡ ΜΕ ΚΕΝΤΡΙΚΗ ΘΕΡΜΑΝΣΗ ΠΕΤΡΕΛΑΙΟΥ. ΑΠΟΤΕΛΕΙΤΑΙ ΑΠΟ 1 ΥΠΝΟΔΩΜΑΤΙΟ 1 ΚΟΥΖΙΝΑ 1 ΣΑΛΟΝΙ ΚΑΙ ΜΠΑΝΙΟ. ΕΙΝΑΙ ΚΑΤΑΣΚΕΥΑΣΜΕΝΟ ΤΟ 1975 ΒΑΜΜΕΝΟ ΚΑΙ ΔΙΑΘΕΤΕΙ ΩΡΑΙΑ ΘΕΑ ΚΟΥΦΩΜΑΤΑ ΑΛΟΥΜΙΝΙΟΥ ΜΕ ΔΙΠΛΑ ΤΖΑΜΙΑ ΠΟΡΤΑ ΑΣΦΑΛΕΙΑΣ ΚΛΙΜΑΤΙΣΜΟ ΔΑΠΕΔΑ ΑΠΟ ΠΛΑΚΑΚΙ ΣΙΤΕΣ ΗΛΙΑΚΟ ΘΕΡΜΟΣΙΦΩΝΑ. ΤΟ ΑΚΙΝΗΤΟ ΠΡΟΤΕΙΝΕΤΑΙ ΩΣ ΕΠΕΝΔΥΤΙΚΟ. ΕΙΝΑΙ ΙΔΑΝΙΚΟ ΓΙΑ ΦΟΙΤΗΤΕΣ.     ΤΙΜΗ 75.000€ | ΚΩΔΙΚΟΣ ΑΚΙΝΗΤΟΥ: 22753 ΑΚΙΝΗΤΑ ΑΠΟΚΛΕΙΣΤΙΚΗΣ ΔΙΑΘΕΣΗΣ ΜΕ ΦΩΤΟΓΡΑΦΙΕΣ ΠΟΥ ΔΙΑΧΕΙΡΙΖΕΤΑΙ Η ΕΤΑΙΡΙΑ ΜΑΣ ΘΑ ΒΡΕΙΤΕ ΣΤΗΝ ΙΣΤΟΣΕΛΙΔΑ ΜΑΣ. WEBSITE: www.tzelirealestate.gr ΓΙΑ ΤΗΝ ΚΑΛΥΤΕΡΗ ΕΞΥΠΗΡΕΤΗΣΗ ΣΑΣ ΧΡΗΣΙΜΟΠΟΙΕΙΣΤΕ ΤΟΝ ΚΩΔΙΚΟ ΑΚΙΝΗΤΟΥ ΠΟΥ ΑΝΑΓΡΑΦΕΤΑΙ ΣΤΗΝ ΠΕΡΙΓΡΑΦΗ. Η ΔΙΕΥΘΥΝΣΗ ΣΤΟΝ ΧΑΡΤΗ ΕΧΕΙ ΤΟΠΟΘΕΤΗΘΕΙ ΚΑΤΑ ΠΡΟΣΕΓΓΙΣΗ. ΟΙ ΑΚΡΙΒΕΙΣ ΠΛΗΡΟΦΟΡΙΕΣ ΤΗΣ ΔΙΕΥΘΥΝΣΗΣ ΠΑΡΕΧΟΝΤΑΙ ΣΤΗΝ ΥΠΟΔΕΙΞΗ ΤΟΥ ΑΚΙΝΗΤΟΥ.
51,100414,residence,Πάτρα,buy,32000,Διαμέρισμα 33 τ.μ.,ΚΩΔΙΚΟΣ ΑΚΙΝΗΤΟΥ: 22607 | ΠΑΤΡΑ ΖΑΡΟΥΧΛΕΙΚΑ: ΠΩΛΕΙΤΑΙ ΓΚΑΡΣΟΝΙΕΡΑ 33Τ.Μ. ΠΡΟΣΟΨΕΩΣ ΣΕ ΙΣΟΓΕΙΟ ΜΕ ΚΕΝΤΡΙΚΗ ΘΕΡΜΑΝΣΗ ΠΕΤΡΕΛΑΙΟΥ. ΑΠΟΤΕΛΕΙΤΑΙ ΑΠΟ 1 ΥΠΝΟΔΩΜΑΤΙΟ 1 ΚΟΥΖΙΝΑ ΚΑΙ ΜΠΑΝΙΟ. ΕΙΝΑΙ ΚΑΤΑΣΚΕΥΑΣΜΕΝΗ ΤΟ 2002 ΚΑΙ ΔΙΑΘΕΤΕΙ ΩΡΑΙΑ ΘΕΑ ΚΟΥΦΩΜΑΤΑ ΑΛΟΥΜΙΝΙΟΥ ΜΕ ΔΙΠΛΑ ΤΖΑΜΙΑ ΔΑΠΕΔΑ ΑΠΟ ΠΛΑΚΑΚΙ. ΤΟ ΑΚΙΝΗΤΟ ΠΡΟΤΕΙΝΕΤΑΙ ΩΣ ΕΠΕΝΔΥΤΙΚΟ. ΕΙΝΑΙ ΙΔΑΝΙΚΗ ΓΙΑ ΦΟΙΤΗΤΕΣ.     ΤΙΜΗ 32.000€ | ΚΩΔΙΚΟΣ ΑΚΙΝΗΤΟΥ: 22607 ΑΚΙΝΗΤΑ ΑΠΟΚΛΕΙΣΤΙΚΗΣ ΔΙΑΘΕΣΗΣ ΜΕ ΦΩΤΟΓΡΑΦΙΕΣ ΠΟΥ ΔΙΑΧΕΙΡΙΖΕΤΑΙ Η ΕΤΑΙΡΙΑ ΜΑΣ ΘΑ ΒΡΕΙΤΕ ΣΤΗΝ ΙΣΤΟΣΕΛΙΔΑ ΜΑΣ. WEBSITE: www.tzelirealestate.gr ΓΙΑ ΤΗΝ ΚΑΛΥΤΕΡΗ ΕΞΥΠΗΡΕΤΗΣΗ ΣΑΣ ΧΡΗΣΙΜΟΠΟΙΕΙΣΤΕ ΤΟΝ ΚΩΔΙΚΟ ΑΚΙΝΗΤΟΥ ΠΟΥ ΑΝΑΓΡΑΦΕΤΑΙ ΣΤΗΝ ΠΕΡΙΓΡΑΦΗ. Η ΔΙΕΥΘΥΝΣΗ ΣΤΟΝ ΧΑΡΤΗ ΕΧΕΙ ΤΟΠΟΘΕΤΗΘΕΙ ΚΑΤΑ ΠΡΟΣΕΓΓΙΣΗ. ΟΙ ΑΚΡΙΒΕΙΣ ΠΛΗΡΟΦΟΡΙΕΣ ΤΗΣ ΔΙΕΥΘΥΝΣΗΣ ΠΑΡΕΧΟΝΤΑΙ ΣΤΗΝ ΥΠΟΔΕΙΞΗ ΤΟΥ ΑΚΙΝΗΤΟΥ.
52,100150,residence,Πάτρα,buy,220000,Διαμέρισμα 110 τ.μ.,ΚΩΔΙΚΟΣ ΑΚΙΝΗΤΟΥ: 3282 | ΠΑΤΡΑ ΠΡΟΑΣΤΙΟ: ΠΩΛΕΙΤΑΙ ΓΩΝΙΑΚΟ ΔΙΑΜΕΡΙΣΜΑ 110Τ.Μ. ΠΟΛΥΤΕΛΕΙΑΣ ΠΡΟΣΟΨΕΩΣ ΣΤΟΝ 1o ΟΡΟΦΟ ΜΕ ΑΥΤΟΝΟΜΗ ΘΕΡΜΑΝΣΗ ΠΕΤΡΕΛΑΙΟΥ. ΑΠΟΤΕΛΕΙΤΑΙ ΑΠΟ 3 ΥΠΝΟΔΩΜΑΤΙΑ 1 ΣΑΛΟΝΟΚΟΥΖΙΝΑ ΑΠΟΘΗΚΗ ΜΠΑΝΙΟ ΚΑΙ 1 WC. ΕΙΝΑΙ ΠΛΗΡΩΣ ΕΠΙΠΛΩΜΕΝΟ ΕΞΟΠΛΙΣΜΕΝΟ ΜΕ ΗΛΕΚΤΡΙΚΕΣ ΣΥΣΚΕΥΕΣ ΚΑΤΑΣΚΕΥΑΣΜΕΝΟ ΤΟ 2010 ΒΑΜΜΕΝΟ ΚΑΙ ΔΙΑΘΕΤΕΙ ΩΡΑΙΑ ΘΕΑ ΚΟΥΦΩΜΑΤΑ ΑΛΟΥΜΙΝΙΟΥ ΜΕ ΔΙΠΛΑ ΤΖΑΜΙΑ ΘΩΡΑΚΙΣΜΕΝΗ ΠΟΡΤΑ ΕΣΩΤΕΡΙΚΗ ΘΕΣΗ ΣΤΑΘΜΕΥΣΗΣ ΚΛΙΜΑΤΙΣΜΟ ΕΝΕΡΓΕΙΑΚΗ ΚΛΑΣΗ B+ ΔΑΠΕΔΑ ΑΠΟ ΠΛΑΚΑΚΙ ΤΖΑΚΙ ΣΙΤΕΣ ΗΛΙΑΚΟ ΘΕΡΜΟΣΙΦΩΝΑ. ΤΟ ΑΚΙΝΗΤΟ ΠΡΟΤΕΙΝΕΤΑΙ ΩΣ ΕΠΕΝΔΥΤΙΚΟ. ΕΙΝΑΙ ΙΔΑΝΙΚΟ ΓΙΑ ΟΙΚΟΓΕΝΕΙΕΣ Η ΕΡΓΑΖΟΜΕΝΟΥΣ ΚΑΙ ΕΠΙΤΡΕΠΟΝΤΑΙ ΤΑ ΚΑΤΟΙΚΙΔΙΑ. ΤΙΜΗ 220.000€   | ΚΩΔΙΚΟΣ ΑΚΙΝΗΤΟΥ: 3282   ΓΙΑ ΠΕΡΙΣΣΟΤΕΡΕΣ ΦΩΤΟΓΡΑΦΙΕΣ ΤΟΥ ΧΩΡΟΥ ΕΠΙΣΚΕΦΘΕΙΤΕ ΤΗ ΣΕΛΙΔΑ ΜΑΣ. Η ΚΟΥΚΚΙΔΑ ΣΤΟΥΣ ΧΑΡΤΕΣ ΤΟΠΟΘΕΤΕΙΤΑΙ ΚΑΤΑ ΠΡΟΣΕΓΓΙΣΗ.   ΜΕΣΙΤΙΚΟ ΓΡΑΦΕΙΟ «NUEVA CASA» ΔΙΕΥΘΥΝΣΗ: ΠΑΝΤΑΝΑΣΣΗΣ 53 ΠΑΤΡΑ WEBSITE: WWW.NUEVACASA.ESTATE E-MAIL: NUEVA_CASA@OUTLOOK.COM ΤΗΛ. ΕΠΙΚΟΙΝΩΝΙΑΣ: 2614 010 635 ΚΙΝΗΤΟ: 6909 569 549 -
53,100455,residence,Πάτρα,buy,260000,Μονοκατοικία 85 τ.μ.,κατάλληλο για κύρια κατοικία για εξοχική και για επένδυση πολύ κοντά στα ΤΕΙ Πατρών μπορεί να ενοικιαστεί σε 3 φοιτητές στην τιμή 750 .e - 800 .e
54,100099,residence,Πάτρα,buy,150000,Διαμέρισμα 128 τ.μ.,Προς Πώληση Διαμέρισμα Πάτρα Αγία Σοφία 128 τ.μ. 5ος Όροφος 3 Υ/Δ 1 Μπάνιο/α 1 WC 1 Κουζίνα/ες 1 Τζάκι/α Δάπεδα: Πλακάκια Kουφώματα: Αλουμινίου Έτος κατασκευής: 1990 Κατάσταση: Πολύ καλή Ενεργειακό Πιστοποιητικό: Δ Χαρακτηριστικά: Ασανσέρ Αποθήκη Τζάκι Διπλά Τζάμια Τέντες Βεράντες BBQ Επενδυτικό Ρετιρέ Διαμπερές Προσόψεως Φωτεινό Γωνιακό Κλιματισμός Για Φοιτητές μεγάλο μπαλκόνι Αυτόνομη - Πετρέλαιο Θέρμανση Θέα: Καλή Κοντά σε: στάση λεωφορείουστάση του ΟΣΕΚέντρο Πάτρας Τιμή: 150.000€ ekatoikia Real Estate 2610622682 www.ekatoikia.gr
55,100068,residence,Πάτρα,buy,52000,Διαμέρισμα 35 τ.μ.,ΚΩΔΙΚΟΣ ΑΚΙΝΗΤΟΥ: 5317 | ΠΑΤΡΑ ΣΚΑΓΙΟΠΟΥΛΕΙΟ: ΠΩΛΕΙΤΑΙ ΠΛΗΡΩΣ ΑΝΑΚΑΙΝΙΣΜΕΝΟ ΔΙΑΜΕΡΙΣΜΑ 35Τ.Μ. ΣΤΟΝ 1Ο ΟΡΟΦΟ ΜΕ ΑΣΑΝΣΕΡ ΜΕ ΚΕΝΤΡΙΚΗ ΘΕΡΜΑΝΣΗ ΠΕΤΡΕΛΑΙΟΥ. ΑΠΟΤΕΛΕΙΤΑΙ ΑΠΟ 1 ΥΠΝΟΔΩΜΑΤΙΟ 1 ΚΟΥΖΙΝΑ ΚΑΙ ΜΠΑΝΙΟ. ΕΙΝΑΙ ΠΛΗΡΩΣ ΕΠΙΠΛΩΜΕΝΟ ΕΞΟΠΛΙΣΜΕΝΟ ΜΕ ΗΛΕΚΤΡΙΚΕΣ ΣΥΣΚΕΥΕΣ ΚΑΤΑΣΚΕΥΑΣΜΕΝΟ ΤΟ 1985 ΒΑΜΜΕΝΟ ΚΑΙ ΔΙΑΘΕΤΕΙ ΩΡΑΙΑ ΘΕΑ ΚΟΥΦΩΜΑΤΑ ΑΛΟΥΜΙΝΙΟΥ ΜΕ ΔΙΠΛΑ ΤΖΑΜΙΑ ΘΩΡΑΚΙΣΜΕΝΗ ΠΟΡΤΑ ΚΛΙΜΑΤΙΣΜΟ ΕΝΕΡΓΕΙΑΚΗ ΚΛΑΣΗ Γ ΔΑΠΕΔΑ ΑΠΟ ΜΑΡΜΑΡΟ & ΠΛΑΚΑΚΙ. ΤΟ ΑΚΙΝΗΤΟ ΠΡΟΤΕΙΝΕΤΑΙ ΩΣ ΕΠΕΝΔΥΤΙΚΟ. ΕΙΝΑΙ ΙΔΑΝΙΚΟ ΓΙΑ ΦΟΙΤΗΤΕΣ Η ΕΡΓΑΖΟΜΕΝΟΥΣ ΜΕ ΕΛΑΧΙΣΤΑ ΚΟΙΝΟΧΡΗΣΤΑ ΚΑΙ ΕΠΙΤΡΕΠΟΝΤΑΙ ΤΑ ΚΑΤΟΙΚΙΔΙΑ. ΤΙΜΗ 52.000€   | ΚΩΔΙΚΟΣ ΑΚΙΝΗΤΟΥ: 5317 ΟΛΑ ΤΑ ΑΚΙΝΗΤΑ ΠΟΥ ΕΧΕΙ ΑΝΑΛΑΒΕΙ ΤΟ ΓΡΑΦΕΙΟ ΜΑΣ ΜΠΟΡΕΙΤΕ ΝΑ ΤΑ ΒΡΕΙΤΕ ΣΥΓΚΕΝΤΡΩΜΕΝΑ ΣΤΟ SITE ΜΑΣ: WWW.NUEVACASA.ESTATE Η ΚΟΥΚΚΙΔΑ ΣΤΟΥΣ ΧΑΡΤΕΣ ΤΟΠΟΘΕΤΕΙΤΑΙ ΚΑΤΑ ΠΡΟΣΕΓΓΙΣΗ Η ΑΚΡΙΒΗΣ ΔΙΕΥΘΥΝΣΗ ΤΟΥ ΑΚΙΝΗΤΟΥ ΔΙΝΕΤΑΙ ΚΑΤΟΠΙΝ ΥΠΟΓΡΑΦΗΣ ΤΗΣ ΕΝΤΟΛΗΣ ΥΠΟΔΕΙΞΕΩΣ ΑΥΤΟΥ ΜΕΣΙΤΙΚΟ ΓΡΑΦΕΙΟ «NUEVA CASA» ΔΙΕΥΘΥΝΣΗ: ΠΑΝΤΑΝΑΣΣΗΣ 53 ΠΑΤΡΑ WEBSITE: WWW.NUEVACASA.ESTATE E-MAIL: NUEVA_CASA@OUTLOOK.COM ΤΗΛ. ΕΠΙΚΟΙΝΩΝΙΑΣ: 2614 010 635 ΚΙΝΗΤΟ: 6909 569 549
56,100435,residence,Πάτρα,buy,135000,Διαμέρισμα 105 τ.μ.,Προς Πώληση Διαμέρισμα Πάτρα Ανθούπολη 105 τ.μ. 2ος Όροφος 3 Υ/Δ 1 Μπάνιο/α 1 Κουζίνα/ες Δάπεδα: Πλακάκια Kουφώματα: Αλουμινίου 1 parking Έτος κατασκευής: 1999 Κατάσταση: Καταπληκτική Ενεργειακό Πιστοποιητικό: Ε Χαρακτηριστικά: Ασανσέρ Πόρτα Ασφαλείας Θυροτηλεόραση Αποθήκη Νυχτερινό ρεύμα Διπλά Τζάμια Τέντες Βεράντες Επενδυτικό Διαμπερές Προσόψεως Φωτεινό Γωνιακό ανοιχτό parking μεγάλο μπαλκόνι Αυτόνομη - Πετρέλαιο Θέρμανση Θέα: Καλή Κοντά σε: στάση λεωφορείουαγορά Τιμή: 135.000€ ekatoikia Real Estate 2610622682 www.ekatoikia.gr
57,100373,residence,Πάτρα,buy,48000,Διαμέρισμα 30 τ.μ.,ΚΩΔΙΚΟΣ ΑΚΙΝΗΤΟΥ: 4891 | ΠΑΤΡΑ ΨΑΡΟΦΑΙ: ΠΩΛΕΙΤΑΙ STUDIO 30Τ.Μ. ΠΡΟΣΟΨΕΩΣ ΣΤΟΝ 4Ο ΟΡΟΦΟ ΜΕ ΑΣΑΝΣΕΡ ΜΕ ΑΥΤΟΝΟΜΗ ΘΕΡΜΑΝΣΗ ΠΕΤΡΕΛΑΙΟΥ. ΑΠΟΤΕΛΕΙΤΑΙ ΑΠΟ 1 ΥΠΝΟΔΩΜΑΤΙΟ 1 ΚΟΥΖΙΝΑ ΚΑΙ ΜΠΑΝΙΟ. ΕΙΝΑΙ ΜΕΡΙΚΩΣ ΕΠΙΠΛΩΜΕΝΟ ΕΞΟΠΛΙΣΜΕΝΟ ΜΕ ΗΛΕΚΤΡΙΚΕΣ ΣΥΣΚΕΥΕΣ ΚΑΤΑΣΚΕΥΑΣΜΕΝΟ ΤΟ 2007 ΒΑΜΜΕΝΟ ΚΑΙ ΔΙΑΘΕΤΕΙ ΘΕΑ ΣΤΟ ΒΟΥΝΟ ΚΟΥΦΩΜΑΤΑ ΑΛΟΥΜΙΝΙΟΥ ΜΕ ΔΙΠΛΑ ΤΖΑΜΙΑ ΚΛΙΜΑΤΙΣΜΟ ΕΝΕΡΓΕΙΑΚΗ ΚΛΑΣΗ B ΔΑΠΕΔΑ ΑΠΟ ΠΛΑΚΑΚΙ. ΤΟ ΑΚΙΝΗΤΟ ΠΡΟΤΕΙΝΕΤΑΙ ΩΣ ΕΠΕΝΔΥΤΙΚΟ. ΕΙΝΑΙ ΙΔΑΝΙΚΟ ΓΙΑ ΦΟΙΤΗΤΕΣ Η ΕΡΓΑΖΟΜΕΝΟΥΣ ΜΕ ΕΛΑΧΙΣΤΑ ΚΟΙΝΟΧΡΗΣΤΑ ΚΑΙ ΕΠΙΤΡΕΠΟΝΤΑΙ ΤΑ ΚΑΤΟΙΚΙΔΙΑ. ΤΙΜΗ 48.000€   | ΚΩΔΙΚΟΣ ΑΚΙΝΗΤΟΥ: 4891 ΟΛΑ ΤΑ ΑΚΙΝΗΤΑ ΠΟΥ ΕΧΕΙ ΑΝΑΛΑΒΕΙ ΤΟ ΓΡΑΦΕΙΟ ΜΑΣ ΜΠΟΡΕΙΤΕ ΝΑ ΤΑ ΒΡΕΙΤΕ ΣΥΓΚΕΝΤΡΩΜΕΝΑ ΣΤΟ SITE ΜΑΣ: WWW.NUEVACASA.ESTATE Η ΚΟΥΚΚΙΔΑ ΣΤΟΥΣ ΧΑΡΤΕΣ ΤΟΠΟΘΕΤΕΙΤΑΙ ΚΑΤΑ ΠΡΟΣΕΓΓΙΣΗ Η ΑΚΡΙΒΗΣ ΔΙΕΥΘΥΝΣΗ ΤΟΥ ΑΚΙΝΗΤΟΥ ΔΙΝΕΤΑΙ ΚΑΤΟΠΙΝ ΥΠΟΓΡΑΦΗΣ ΤΗΣ ΕΝΤΟΛΗΣ ΥΠΟΔΕΙΞΕΩΣ ΑΥΤΟΥ ΜΕΣΙΤΙΚΟ ΓΡΑΦΕΙΟ «NUEVA CASA» ΔΙΕΥΘΥΝΣΗ: ΠΑΝΤΑΝΑΣΣΗΣ 53 ΠΑΤΡΑ WEBSITE: WWW.NUEVACASA.ESTATE E-MAIL: NUEVA_CASA@OUTLOOK.COM ΤΗΛ. ΕΠΙΚΟΙΝΩΝΙΑΣ: 2614 010 635 ΚΙΝΗΤΟ: 6909 569 549
58,100446,residence,Πάτρα,buy,49000,Διαμέρισμα 50 τ.μ.,ΚΩΔΙΚΟΣ ΑΚΙΝΗΤΟΥ: 22597 | ΠΑΤΡΑ ΣΚΑΓΙΟΠΟΥΛΕΙΟ: ΠΩΛΕΙΤΑΙ ΜΕΡΙΚΩΣ ΑΝΑΚΑΙΝΙΣΜΕΝΟ ΔΙΑΜΕΡΙΣΜΑ 50Τ.Μ. ΠΡΟΣΟΨΕΩΣ ΣΤΟΝ 2 ΟΡΟΦΟ ΜΕ ΑΣΑΝΣΕΡ ΜΕ ΚΕΝΤΡΙΚΗ ΘΕΡΜΑΝΣΗ ΠΕΤΡΕΛΑΙΟΥ. ΑΠΟΤΕΛΕΙΤΑΙ ΑΠΟ 1 ΥΠΝΟΔΩΜΑΤΙΟ 1 ΚΟΥΖΙΝΑ 1 ΣΑΛΟΝΙ ΚΑΙ ΜΠΑΝΙΟ. ΕΙΝΑΙ ΚΑΤΑΣΚΕΥΑΣΜΕΝΟ ΤΟ 1973 ΚΑΙ ΔΙΑΘΕΤΕΙ ΩΡΑΙΑ ΘΕΑ ΚΛΙΜΑΤΙΣΜΟ ΔΑΠΕΔΑ ΑΠΟ ΠΛΑΚΑΚΙ. ΤΟ ΑΚΙΝΗΤΟ ΠΡΟΤΕΙΝΕΤΑΙ ΩΣ ΕΠΕΝΔΥΤΙΚΟ. ΕΙΝΑΙ ΙΔΑΝΙΚΟ ΓΙΑ ΦΟΙΤΗΤΕΣ.     ΤΙΜΗ 49.000€ | ΚΩΔΙΚΟΣ ΑΚΙΝΗΤΟΥ: 22597 ΑΚΙΝΗΤΑ ΑΠΟΚΛΕΙΣΤΙΚΗΣ ΔΙΑΘΕΣΗΣ ΜΕ ΦΩΤΟΓΡΑΦΙΕΣ ΠΟΥ ΔΙΑΧΕΙΡΙΖΕΤΑΙ Η ΕΤΑΙΡΙΑ ΜΑΣ ΘΑ ΒΡΕΙΤΕ ΣΤΗΝ ΙΣΤΟΣΕΛΙΔΑ ΜΑΣ. WEBSITE: www.tzelirealestate.gr ΓΙΑ ΤΗΝ ΚΑΛΥΤΕΡΗ ΕΞΥΠΗΡΕΤΗΣΗ ΣΑΣ ΧΡΗΣΙΜΟΠΟΙΕΙΣΤΕ ΤΟΝ ΚΩΔΙΚΟ ΑΚΙΝΗΤΟΥ ΠΟΥ ΑΝΑΓΡΑΦΕΤΑΙ ΣΤΗΝ ΠΕΡΙΓΡΑΦΗ. Η ΔΙΕΥΘΥΝΣΗ ΣΤΟΝ ΧΑΡΤΗ ΕΧΕΙ ΤΟΠΟΘΕΤΗΘΕΙ ΚΑΤΑ ΠΡΟΣΕΓΓΙΣΗ. ΟΙ ΑΚΡΙΒΕΙΣ ΠΛΗΡΟΦΟΡΙΕΣ ΤΗΣ ΔΙΕΥΘΥΝΣΗΣ ΠΑΡΕΧΟΝΤΑΙ ΣΤΗΝ ΥΠΟΔΕΙΞΗ ΤΟΥ ΑΚΙΝΗΤΟΥ.
59,100311,residence,Πάτρα,buy,23000,Διαμέρισμα 25 τ.μ.,Πάτρα Υψηλά Αλώνια: Πωλείται διαμπερής Γκαρσονιέρα 25τ.μ. προσόψεως στον 7ο όροφο με ασανσέρ με κεντρική θέρμανση πετρελαίου. Αποτελείται από 1 υπνοδωμάτιο 1 σαλονοκουζίνα 1 κουζίνα 1 σαλόνι και μπάνιο. Είναι κατασκευασμένη το 1971 βαμμένη και διαθέτει ωραία θέα κλιματισμό ενεργειακή κλάση Ε δάπεδα από μωσαϊκό. Το ακίνητο προτείνεται ως επενδυτικό. Είναι ιδανική για φοιτητές ή εργαζόμενους. Τιμή 23.000€ | Κωδικός Ακινήτου: 14059 Το στίγμα στον χάρτη είναι ενδεικτικό και αποτυπώνει την ευρύτερη περιοχή. ATALLAS (GREEK COAST) REAL ESTATE Τηλέφωνο Επικοινωνίας: (+30) 2610222005 (+30) 2610424008 Διεύθυνση: Κορίνθου 162 Πάτρα 26223 Ιστοσελίδα: www.greekcoast.gr
60,100118,residence,Πάτρα,buy,250000,Μεζονέτα 244 τ.μ.,Πάτρα Μεζονέτα Προς Πώληση 244 τ.μ. Σε οικόπεδο 663 τ.μ. Κατάσταση: Καλή 3 Επίπεδο/α 3 Υ/Δ 1 Κουζίνα/ες 1 Μπάνιο/α Θέρμανση: Αυτόνομη Έτος κατασκευής: 2008 Ενεργειακό Πιστοποιητικό: Δ Δάπεδα: Πλακάκια Kουφώματα: Αλουμινίου Χαρακτηριστικά: Πόρτα Ασφαλείας Τζάκι Καλωδιακή Τηλεόραση Εσωτερική Σκάλα Διπλά Τζάμια Βεράντες Χωρίς Κοινόχρηστα Διαμπερές Φωτεινό Κλιματισμός Κήπος Διώροφη μεζονέτα συνολικής επιφάνειας 24446 τ.μ. (αποτελούμενη από ισόγειο εμβαδού 73.14 τ.μ. Α` ορόφου υπό στοιχεία (Α-1) εμβαδού 67.62 τ.μ. και υπόγειο εμβαδού 65.39 τ.μ. και 16.65 τ.μ. πατάρι εμβαδού 21.66 τ.μ. σε οικόπεδο έκτασης 6639 τ.μ. Το ακίνητο είναι εκμισθωμένο μέχρις τις 31/3/2022 με ποσό 300 ευρώ) Προσανατολισμός: Ανατολικομεσημβρινός Κοντά σε: Βρίσκεται 200 m από το λιμάνι της Πάτρας Απόσταση απο: Θάλασσα(m): 200 Τιμή: 250.000€. MACONSTRUCTION Τηλ. Επικοινωνίας: 2110011405 email: properties@maconstruction.gr
