ad_id,publisher_id,type,location,purpose,price,title,description
122,100362,prof,Πάτρα,buy,120000,Αποθήκη 270 τ.μ.,ΚΩΔΙΚΟΣ ΑΚΙΝΗΤΟΥ: 18164 | ΠΑΤΡΑ ΠΛΑΤΕΙΑ ΠΑΠΑΝΔΡΕΟΥ: ΠΩΛΕΙΤΑΙ ΔΙΑΜΠΕΡΗΣ ΓΩΝΙΑΚΗ ΑΠΟΘΗΚΗ 270Τ.Μ. ΠΡΟΣΟΨΕΩΣ ΣΕ ΙΣΟΓΕΙΟ. ΑΠΟΤΕΛΕΙΤΑΙ ΑΠΟ 3 ΧΩΡΟΥΣ 1 ΚΟΥΖΙΝΑ ΚΑΙ 1 WC. ΕΙΝΑΙ ΚΑΤΑΣΚΕΥΑΣΜΕΝΗ ΤΟ 1990 ΚΑΙ ΔΙΑΘΕΤΕΙ ΚΟΥΦΩΜΑΤΑ ΑΛΟΥΜΙΝΙΟΥ ΔΑΠΕΔΑ ΑΠΟ ΠΛΑΚΑΚΙ ΚΑΙ ΜΑΡΜΑΡΟ. ΤΟ ΑΚΙΝΗΤΟ ΠΡΟΤΕΙΝΕΤΑΙ ΩΣ ΕΠΕΝΔΥΤΙΚΟ.   ΤΙΜΗ 120.000€ | ΚΩΔΙΚΟΣ ΑΚΙΝΗΤΟΥ: 18164 ΑΚΙΝΗΤΑ ΑΠΟΚΛΕΙΣΤΙΚΗΣ ΔΙΑΘΕΣΗΣ ΜΕ ΦΩΤΟΓΡΑΦΙΕΣ ΠΟΥ ΔΙΑΧΕΙΡΙΖΕΤΑΙ Η ΕΤΑΙΡΙΑ ΜΑΣ ΘΑ ΒΡΕΙΤΕ ΣΤΗΝ ΙΣΤΟΣΕΛΙΔΑ ΜΑΣ. WEBSITE: www.tzelirealestate.gr ΓΙΑ ΤΗΝ ΚΑΛΥΤΕΡΗ ΕΞΥΠΗΡΕΤΗΣΗ ΣΑΣ ΧΡΗΣΙΜΟΠΟΙΕΙΣΤΕ ΤΟΝ ΚΩΔΙΚΟ ΑΚΙΝΗΤΟΥ ΠΟΥ ΑΝΑΓΡΑΦΕΤΑΙ ΣΤΗΝ ΠΕΡΙΓΡΑΦΗ. Η ΔΙΕΥΘΥΝΣΗ ΣΤΟΝ ΧΑΡΤΗ ΕΧΕΙ ΤΟΠΟΘΕΤΗΘΕΙ ΚΑΤΑ ΠΡΟΣΕΓΓΙΣΗ. ΟΙ ΑΚΡΙΒΕΙΣ ΠΛΗΡΟΦΟΡΙΕΣ ΤΗΣ ΔΙΕΥΘΥΝΣΗΣ ΠΑΡΕΧΟΝΤΑΙ ΣΤΗΝ ΥΠΟΔΕΙΞΗ ΤΟΥ ΑΚΙΝΗΤΟΥ.
123,100399,prof,Πάτρα,buy,55000,Κατάστημα 75 τ.μ.,Πάτρα Αγία Σοφία: Πωλείται Κατάστημα 75τ.μ. προσόψεως σε ισόγειο. Αποτελείται από 2 χώρους αποθήκη και 1 WC. Είναι κατασκευασμένο το 1980 και διαθέτει ωραία θέα ενεργειακή κλάση Ε δάπεδα από πλακάκι.. Τιμή 55.000€ | Κωδικός Ακινήτου: 13524 ATALLAS (GREEK COAST) REAL ESTATE Τηλέφωνο Επικοινωνίας: (+30) 2610222005 (+30) 2610424008 Διεύθυνση: Κορίνθου 162 Πάτρα 26223 Ιστοσελίδα: www.greekcoast.gr
124,100186,prof,Πάτρα,buy,2000000,Κτίριο 2.024 τ.μ.,
125,100264,prof,Πάτρα,buy,65000,Γραφείο 55 τ.μ.,Κωδικός ακινήτου: 2949 - Πάτρα Πάτρα - Κέντρο ΠΩΛΕΙΤΑΙ γραφείο στον 2 ο όροφο συνολικής επιφάνειας 55 τ.μ. σε οικόπεδο 300 τ.μ. . Αποτελείται από 2 χώρους και WC. Είναι κατασκευασμένο το 1978 και διαθέτει θέρμανση ατομική - ηλεκτρικό κουφώματα αλουμινίου μαρμάρινα πατώματα ντουλάπες ανελκυστήρα πρόσβαση ΑΜΕΑ A/C διπλά τζάμια σκαλιά εισόδου ανοιχτωσιά μπαλκόνια 7 τ.μ. απόσταση από θάλασσα 750 μέτρα - Τιμή: 65.000 € https://www.akinitapatras.gr/property.php?thecode=2949
126,100018,prof,Πάτρα,buy,1000000,Κτίριο 2.050 τ.μ.,ΚΩΔΙΚΟΣ ΑΚΙΝΗΤΟΥ: 17589 | ΠΑΤΡΑ Β.Ι.Ο.ΠΑ: ΠΩΛΕΙΤΑΙ ΝΕΟΔΜΗΤΟ ΔΙΑΜΠΕΡΕΣ ΓΩΝΙΑΚΟ ΚΤΙΡΙΟ ΕΠΑΓΓΕΛΜΑΤΙΚΩΝ ΧΩΡΩΝ 2050Τ.Μ. ΠΡΟΣΟΨΕΩΣ ΣΕ ΙΣΟΓΕΙΟ 4 ΕΠΙΠΕΔΩΝ. ΑΠΟΤΕΛΕΙΤΑΙ ΑΠΟ ΤΟ ΥΠΟΓΕΙΟ ΤΟ ΟΠΟΙΟ ΔΙΑΘΕΤΕΙ ΔΥΟ ΑΝΕΞΑΡΤΗΤΑ ΚΑΤΑΣΤΗΜΑΤΑ ΜΕ ΡΑΜΠΕΣ 500Τ.Μ. ΚΑΙ 250Τ.Μ. ΤΟ ΚΑΘΕΝΑ. ΙΣΟΓΕΙΟ ΜΕ ΔΥΟ ΕΠΙΣΗΣ ΑΝΕΞΑΡΤΗΤΑ ΚΑΤΑΣΤΗΜΑΤΑ 325Τ.Μ. ΤΟ ΚΑΘΕΝΑ ΚΑΙ ΠΡΩΤΟ ΟΡΟΦΟ 400Τ.Μ. ΜΕ ΠΑΤΑΡΙ 200Τ.Μ. ΟΛΑ ΔΙΑΘΕΤΟΥΝ WC. TO ΚΤΙΡΙΟ ΕΙΝΑΙ ΚΑΤΑΣΚΕΥΑΣΜΕΝΟ ΤΟ 2009 ΚΑΙ ΔΙΑΘΕΤΕΙ ΩΡΑΙΑ ΘΕΑ ΚΟΥΦΩΜΑΤΑ ΑΛΟΥΜΙΝΙΟΥ ΚΑΙ ΔΑΠΕΔΑ ΑΠΟ ΠΕΤΡΑ. ΤΟ ΑΚΙΝΗΤΟ ΕΧΕΙ ΤΗΝ ΠΑΡΑΚΑΤΩ ΔΙΑΡΡΥΘΜΙΣΗ ΧΩΡΩΝ: ΥΠΟΓΕΙΟ ΙΣΟΓΕΙΟ ΠΡΩΤΟΣ ΟΡΟΦΟΣ ΠΑΤΑΡΙ. ΤΟ ΑΚΙΝΗΤΟ ΠΡΟΤΕΙΝΕΤΑΙ ΩΣ ΕΠΕΝΔΥΤΙΚΟ. ΧΩΡΙΣ ΜΗΝΙΑΙΑ ΚΟΙΝΟΧΡΗΣΤΑ. ΚΑΤΑΛΛΗΛΟ ΓΙΑ ΕΠΑΓΓΕΛΜΑΤΙΚΗ ΧΡΗΣΗ.     ΤΙΜΗ 1.000.000€ | ΚΩΔΙΚΟΣ ΑΚΙΝΗΤΟΥ: 17589 ΑΚΙΝΗΤΑ ΑΠΟΚΛΕΙΣΤΙΚΗΣ ΔΙΑΘΕΣΗΣ ΜΕ ΦΩΤΟΓΡΑΦΙΕΣ ΠΟΥ ΔΙΑΧΕΙΡΙΖΕΤΑΙ Η ΕΤΑΙΡΙΑ ΜΑΣ ΘΑ ΒΡΕΙΤΕ ΣΤΗΝ ΙΣΤΟΣΕΛΙΔΑ ΜΑΣ. WEBSITE: www.tzelirealestate.gr ΓΙΑ ΤΗΝ ΚΑΛΥΤΕΡΗ ΕΞΥΠΗΡΕΤΗΣΗ ΣΑΣ ΧΡΗΣΙΜΟΠΟΙΕΙΣΤΕ ΤΟΝ ΚΩΔΙΚΟ ΑΚΙΝΗΤΟΥ ΠΟΥ ΑΝΑΓΡΑΦΕΤΑΙ ΣΤΗΝ ΠΕΡΙΓΡΑΦΗ. Η ΔΙΕΥΘΥΝΣΗ ΣΤΟΝ ΧΑΡΤΗ ΕΧΕΙ ΤΟΠΟΘΕΤΗΘΕΙ ΚΑΤΑ ΠΡΟΣΕΓΓΙΣΗ. ΟΙ ΑΚΡΙΒΕΙΣ ΠΛΗΡΟΦΟΡΙΕΣ ΤΗΣ ΔΙΕΥΘΥΝΣΗΣ ΠΑΡΕΧΟΝΤΑΙ ΣΤΗΝ ΥΠΟΔΕΙΞΗ ΤΟΥ ΑΚΙΝΗΤΟΥ.
127,100318,prof,Πάτρα,buy,70000,Αποθήκη 222 τ.μ.,Πάτρα Εγλυκάδα Αποθηκευτικός χώρος Προς Πώληση 222 τ.μ. Κατάσταση: Μέτρια Όροφος: Ημιυπόγειο 1 Επίπεδο/α 1 Χώροι 1 WC Έτος κατασκευής: 1970 Ενεργειακό Πιστοποιητικό: Ε Δάπεδα: ΤΣΙΜΕΝΤΟ Kουφώματα: Τζαμαρία Χαρακτηριστικά: Προσόψεως Φωτεινό Γωνιακό Η διεύθυνση είναι ενδεικτική της περιοχής που βρίσκεται το ακίνητο. (Για να μπορέσετε να βρείτε το ακίνητο που σας ταιριάζει  σε πάνω από 1500 ακίνητα που διαχειρίζεται η εταιρία μας επισκεφθείτε την σελίδα μας www.smartdealpatra.gr ΜΕ ΔΥΝΑΤΟΤΗΤΑ ΕΙΚΟΝΙΚΗΣ ΠΕΡΙΗΓΗΣΗΣ .) Κοντά σε: περιμετρικήαγοράσχολείαΝοσοκομείο Αγ.Ανδρέαγήπεδο Απόσταση απο: Αεροδρόμιο(m): 35000 Θάλασσα(m): 5000 Πόλη(m): 4000 Τιμή: 70.000€. SmartDeal Τηλ. Επικοινωνίας: 2610342300 email: smartdealpatra@gmail.com
128,100468,prof,Πάτρα,buy,20000,Αποθήκη 241 τ.μ.,ΚΩΔΙΚΟΣ ΑΚΙΝΗΤΟΥ: 1639 | ΠΑΤΡΑ ΖΑΡΟΥΧΛΕΙΚΑ: ΠΩΛΕΙΤΑΙ ΑΠΟΘΗΚΗ 241Τ.Μ. ΠΡΟΣΟΨΕΩΣ ΣΕ ΗΜΙΥΠΟΓΕΙΟ ΧΩΡΙΣ ΘΕΡΜΑΝΣΗ. ΑΠΟΤΕΛΕΙΤΑΙ ΑΠΟ 1 ΧΩΡΟ ΚΑΙ 2 WC. ΕΙΝΑΙ ΚΑΤΑΣΚΕΥΑΣΜΕΝΗ ΤΟ 1985 ΚΑΙ ΔΙΑΘΕΤΕΙ ΚΟΥΦΩΜΑΤΑ ΑΛΟΥΜΙΝΙΟΥ ΔΑΠΕΔΑ ΑΠΟ ΠΕΤΡΑ. ΤΟ ΑΚΙΝΗΤΟ ΠΡΟΤΕΙΝΕΤΑΙ ΩΣ ΕΠΕΝΔΥΤΙΚΟ. ΧΩΡΙΣ ΜΗΝΙΑΙΑ ΚΟΙΝΟΧΡΗΣΤΑ. ΤΙΜΗ 20.000€   | ΚΩΔΙΚΟΣ ΑΚΙΝΗΤΟΥ: 1639   ΜΕΣΙΤΙΚΟ ΓΡΑΦΕΙΟ NUEVA CASA ΠΑΝΤΑΝΑΣΣΗΣ 53 ΠΑΤΡΑ SITE: WWW.NUEVACASA.ESTATE E-MAIL: NUEVA_CASA@OUTLOOK.COM ΤΗΛ. ΕΠΙΚΟΙΝΩΝΙΑΣ: 2614010635 / 6909 569 549 -
129,100031,prof,Πάτρα,buy,160000,Κατάστημα 340 τ.μ.,Πωλείται προνομιούχο κατάστημα 340τ.μ. ισόγειο 120τ.μ. πατάρι 130τ.μ. και υπόγειο 110τ.μ. κατασκευής 1990 αρίστη κατάσταση κατάλληλο για σίγουρη επένδυση . βρίσκεται σε σημείο με μέγιστη εμπορική προβολή στη περιοχή. Τιμή πώλησης 160.000€ Αχαϊκό σπίτι Real Estate Πάτρα Αμερικής 68 τηλ.2610336023 email axaikospiti@outlook.com.gr www.axaikospiti.gr
130,100122,prof,Πάτρα,buy,85000,Γραφείο 68 τ.μ.,ΚΩΔΙΚΟΣ ΑΚΙΝΗΤΟΥ: 9051 | ΠΑΤΡΑ ΠΑΤΡΑ - ΚΕΝΤΡΟ: ΠΩΛΕΙΤΑΙ ΠΛΗΡΩΣ ΑΝΑΚΑΙΝΙΣΜΕΝΟ ΔΙΑΜΠΕΡΕΣ ΓΡΑΦΕΙΟ 68Τ.Μ. ΣΤΟΝ 2 ΟΡΟΦΟ ΜΕ ΑΣΑΝΣΕΡ ΜΕ ΑΥΤΟΝΟΜΗ ΘΕΡΜΑΝΣΗ ΡΕΥΜΑΤΟΣ. ΑΠΟΤΕΛΕΙΤΑΙ ΑΠΟ 1 ΧΩΡΟ 1 ΚΟΥΖΙΝΑ ΚΑΙ 1 WC. ΕΙΝΑΙ ΚΑΤΑΣΚΕΥΑΣΜΕΝΟ ΤΟ 1980 ΒΑΜΜΕΝΟ ΚΑΙ ΔΙΑΘΕΤΕΙ ΚΟΥΦΩΜΑΤΑ ΑΛΟΥΜΙΝΙΟΥ ΜΕ ΔΙΠΛΑ ΤΖΑΜΙΑ ΠΟΡΤΑ ΑΣΦΑΛΕΙΑΣ ΚΛΙΜΑΤΙΣΜΟ ΔΑΠΕΔΑ ΑΠΟ ΠΛΑΚΑΚΙ. ΤΟ ΑΚΙΝΗΤΟ ΠΡΟΤΕΙΝΕΤΑΙ ΩΣ ΕΠΕΝΔΥΤΙΚΟ. ΕΙΝΑΙ ΙΔΑΝΙΚΟ ΓΙΑ ΕΠΑΓΓΕΛΜΑΤΙΚΗ ΧΡΗΣΗ.   ΤΙΜΗ 85.000€ | ΚΩΔΙΚΟΣ ΑΚΙΝΗΤΟΥ: 9051 ΑΚΙΝΗΤΑ ΑΠΟΚΛΕΙΣΤΙΚΗΣ ΔΙΑΘΕΣΗΣ ΜΕ ΦΩΤΟΓΡΑΦΙΕΣ ΠΟΥ ΔΙΑΧΕΙΡΙΖΕΤΑΙ Η ΕΤΑΙΡΙΑ ΜΑΣ ΘΑ ΒΡΕΙΤΕ ΣΤΗΝ ΙΣΤΟΣΕΛΙΔΑ ΜΑΣ. WEBSITE: www.tzelirealestate.gr ΓΙΑ ΤΗΝ ΚΑΛΥΤΕΡΗ ΕΞΥΠΗΡΕΤΗΣΗ ΣΑΣ ΧΡΗΣΙΜΟΠΟΙΕΙΣΤΕ ΤΟΝ ΚΩΔΙΚΟ ΑΚΙΝΗΤΟΥ ΠΟΥ ΑΝΑΓΡΑΦΕΤΑΙ ΣΤΗΝ ΠΕΡΙΓΡΑΦΗ. Η ΔΙΕΥΘΥΝΣΗ ΣΤΟΝ ΧΑΡΤΗ ΕΧΕΙ ΤΟΠΟΘΕΤΗΘΕΙ ΚΑΤΑ ΠΡΟΣΕΓΓΙΣΗ. ΟΙ ΑΚΡΙΒΕΙΣ ΠΛΗΡΟΦΟΡΙΕΣ ΤΗΣ ΔΙΕΥΘΥΝΣΗΣ ΠΑΡΕΧΟΝΤΑΙ ΣΤΗΝ ΥΠΟΔΕΙΞΗ ΤΟΥ ΑΚΙΝΗΤΟΥ.
131,100448,prof,Πάτρα,buy,160000,Κτίριο 180 τ.μ.,Πάτρα Αγία Σοφία: Πωλείται ανακαινισμένο Κτίριο επαγγελματικών χώρων 180τ.μ. σε ισόγειο 2 επιπέδων με κεντρική θέρμανση. Αποτελείται από 6 χώρους 1 κουζίνα αποθήκη και 2 WC. Είναι κατασκευασμένο το 1975 βαμμένο και διαθέτει κουφώματα αλουμινίου δάπεδα από μάρμαρο. Το ακίνητο προτείνεται ως επενδυτικό.. Τιμή 160.000€ | Κωδικός Ακινήτου: 21751 ΚΤΗΜΑΤΟΜΕΣΙΤΙΚΕΣ ΥΠΗΡΕΣΙΕΣ ΑΓΓΕΛΟΠΟΥΛΟΣ-ΤΣΕΚΟΥΡΑΣAT REAL ESTATE  ΔΙΕΥΘΥΝΣΗ: ΑΡΑΤΟΥ 28 ΠΑΤΡΑΙΣΟΓΕΙΟ ΚΑΤΑΣΤΗΜΑ. ΤΗΛΕΦΩΝΟ ΕΠΙΚΟΙΝΩΝΙΑΣ : 2610-620180 FAX: 2610-620735  EMAIL: info@libertypatra.gr ΓΙΑ ΠΕΡΙΣΣΟΤΕΡΑ ΑΚΙΝΗΤΑ ΚΑΙ ΠΛΗΡΟΦΟΡΙΕΣ ΕΠΙΣΚΕΦΘΕΙΤΕ ΤΗΝ ΗΛΕΚΤΡΟΚΙΝΗ ΜΑΣ ΣΕΛΙΔΑ ΣΤΗΝ ΔΙΕΥΘΥΝΣΗ : www.atrealestate.gr .Η ΔΙΕΥΘΥΝΣΗ ΕΙΝΑΙ ΕΝΔΕΙΚΤΙΚΗ ΣΤΗΝ ΠΕΡΙΟΧΗ ΠΟΥ ΒΡΙΣΚΕΤΑΙ ΤΟ ΑΚΙΝΗΤΟ .
132,100350,prof,Πάτρα,buy,180000,Κατάστημα 191 τ.μ.,ΠΑΤΡΑ - ΠΕΡΙΟΧΗ ΠΑΠΑΦΛΕΣΣΑ : Διαμπερές ισόγειο κατάστημα προσόψεως  συνολικού εμβαδού 191τ.μ. Αποτελείται απο έναν ενιαίο χώρο και ένα w/c . Διαθέτει μεγάλη πρόσοψη βιτρίνας  εσωτερικές κολόνες με στηρίγματα για κατασκευή παταριού - ορόφου  καθώς και δομημένη καλωδίωση και ανεξάρτητο φωτισμό για πατάρι . Δίδεται και τμηματικά : 145τ.μ. με τιμή ενοικίου 800€ και 46τ.μ. με τιμή ενοικίου 400€ αντίστοιχα . (ΚΩΔ : 3145) (ΤΙΜΗ : 180.000 €) ΜΕΣΙΤΙΚΟ - ΤΕΧΝΙΚΟ ΓΡΑΦΕΙΟ «HELGA REAL ESTATE ? CONSTRUCTION ? ENGINEER PATRA» ΤΟ ΓΡΑΦΕΙΟ ΜΑΣ ΑΝΑΛΑΜΒΑΝΕΙ ΕΠΙΠΛΕΟΝ ΤΗΝ ΕΝΕΡΓΕΙΑΚΗ ΕΠΙΘΕΩΡΗΣΗ ΚΤΙΡΙΩΝ  ΤΗΝ ΕΚΔΟΣΗ ΕΝΕΡΓΕΙΑΚΩΝ ΠΙΣΤΟΠΟΙΗΤΙΚΩΝ  ΤΟΝ ΠΟΛΕΟΔΟΜΙΚΟ ΕΛΕΓΧΟ ΤΩΝ ΑΚΙΝΗΤΩΝ ΣΑΣ  ΚΑΘΩΣ ΚΑΙ ΤΗΝ ΑΝΑΚΑΙΝΙΣΗ ΤΟΥΣ ΕΠΕΙΤΑ ΑΠΟ ΕΝΤΟΛΗ ΤΟΥ ΙΔΙΟΚΤΗΤΗ . ΔΙΕΥΘΥΝΣΗ : ΟΘΩΝΟΣ ΑΜΑΛΙΑΣ 45 3ος όροφος ΠΑΤΡΑ  ΤΗΛΕΦΩΝΟ ΕΠΙΚΟΙΝΩΝΙΑΣ : (+30) 2610437357 EMAIL: info@helga.gr  ΓΙΑ ΠΕΡΙΣΣΟΤΕΡΑ ΑΚΙΝΗΤΑ ΚΑΙ ΠΛΗΡΟΦΟΡΙΕΣ ΕΠΙΣΚΕΦΘΕΙΤΕ ΤΗΝ ΗΛΕΚΤΡΟΝΙΚΗ ΜΑΣ ΣΕΛΙΔΑ ΣΤΗΝ ΔΙΕΥΘΥΝΣΗ www.helga.gr. (ΚΩΔ : 3145) (ΤΙΜΗ : 180.000 €) (Κωδικός Ακινήτου: Γ-3145) -- Απόσταση απο τη θάλασσα 300 Ενεργειακή κλάση B Επιτρέπονται κατοικίδια  Ζώνη Οικιστική Ημιτελές  Κατάλληλο για επαγγελματική χρήση  Νεόδμητο  Προσανατολισμός Ανατολικός Πρόσβαση Ασφαλτος Πρόσοψης  Ρεύμα Τριφασικό Τ.Κ. 262 22 Τύπος Δαπέδων Πλακάκι Φωτεινό
133,100261,prof,Πάτρα,buy,69000,Κατάστημα 120 τ.μ.,Κωδικός ακινήτου: 2-5541 - Πάτρα Άγιος Διονύσιος ΠΩΛΕΙΤΑΙ κατάστημα ισόγειο συνολικής επιφάνειας 120 τ.μ. . Αποτελείται από 1 χώρο μπάνιο . Είναι κατασκευασμένο το 1999 με ενεργειακή κλάση Α+ και διαθέτει κουφώματα αλουμινίου πατώματα από πλακάκι - Τιμή: 69.000 €
134,100284,prof,Πάτρα,buy,420000,Κτίριο 400 τ.μ.,Επί της ακρωτηρίου πλησίον λαχαναγορά. πωλείται τετράφατσο διώροφο επαγγελματικό ακίνητο 400τ.μ.σε οικόπεδο 520τ.μ. κατασκευής 1984.αποτελείται από 2 καταστήματα από 100τ.μ. 2 διαμερίσματα από 100τ.μ.και υπόγειο 200μ.eπίσης υπάρχει μεγάλος προαύλιος χώρος στάθμευσης. διατίθεται πλήρως ανακαινισμένο (προδιαγραφές 2011).βρίσκεται σε πολύ κομβικό εμπορικό σημείο της περιοχής για πολλές επαγγελματικές χρήσεις και μισθωμένο 1.800€ για σοβαρή επένδυση. τιμή πώλησης 420.000€ (κωδ.430) Αχαϊκό σπίτι Real Estate Πάτρα Αμερικής 68 τηλ.2610336023 email axaikospiti@hotmail.com www.axaikospiti.gr
135,100314,prof,Πάτρα,buy,60000,Κατάστημα 110 τ.μ.,ΚΩΔΙΚΟΣ ΑΚΙΝΗΤΟΥ: 9062 | ΠΑΤΡΑ ΤΕΡΨΗ: ΠΩΛΕΙΤΑΙ ΚΑΤΑΣΤΗΜΑ 110Τ.Μ. ΠΡΟΣΟΨΕΩΣ ΣΕ ΙΣΟΓΕΙΟ. ΑΠΟΤΕΛΕΙΤΑΙ ΑΠΟ 1 ΧΩΡΟ ΚΑΙ 1 WC. ΕΙΝΑΙ ΚΑΤΑΣΚΕΥΑΣΜΕΝΟ ΤΟ 1997 ΚΑΙ ΔΙΑΘΕΤΕΙ ΩΡΑΙΑ ΘΕΑ ΚΟΥΦΩΜΑΤΑ ΑΛΟΥΜΙΝΙΟΥ ΔΑΠΕΔΑ ΑΠΟ ΠΛΑΚΑΚΙ. ΤΟ ΑΚΙΝΗΤΟ ΠΡΟΤΕΙΝΕΤΑΙ ΩΣ ΕΠΕΝΔΥΤΙΚΟ.     ΤΙΜΗ 60.000€ | ΚΩΔΙΚΟΣ ΑΚΙΝΗΤΟΥ: 9062 ΑΚΙΝΗΤΑ ΑΠΟΚΛΕΙΣΤΙΚΗΣ ΔΙΑΘΕΣΗΣ ΜΕ ΦΩΤΟΓΡΑΦΙΕΣ ΠΟΥ ΔΙΑΧΕΙΡΙΖΕΤΑΙ Η ΕΤΑΙΡΙΑ ΜΑΣ ΘΑ ΒΡΕΙΤΕ ΣΤΗΝ ΙΣΤΟΣΕΛΙΔΑ ΜΑΣ. WEBSITE: www.tzelirealestate.gr ΓΙΑ ΤΗΝ ΚΑΛΥΤΕΡΗ ΕΞΥΠΗΡΕΤΗΣΗ ΣΑΣ ΧΡΗΣΙΜΟΠΟΙΕΙΣΤΕ ΤΟΝ ΚΩΔΙΚΟ ΑΚΙΝΗΤΟΥ ΠΟΥ ΑΝΑΓΡΑΦΕΤΑΙ ΣΤΗΝ ΠΕΡΙΓΡΑΦΗ. Η ΔΙΕΥΘΥΝΣΗ ΣΤΟΝ ΧΑΡΤΗ ΕΧΕΙ ΤΟΠΟΘΕΤΗΘΕΙ ΚΑΤΑ ΠΡΟΣΕΓΓΙΣΗ. ΟΙ ΑΚΡΙΒΕΙΣ ΠΛΗΡΟΦΟΡΙΕΣ ΤΗΣ ΔΙΕΥΘΥΝΣΗΣ ΠΑΡΕΧΟΝΤΑΙ ΣΤΗΝ ΥΠΟΔΕΙΞΗ ΤΟΥ ΑΚΙΝΗΤΟΥ.
136,100300,prof,Πάτρα,buy,530000,Γραφείο 290 τ.μ.,ΚΩΔΙΚΟΣ ΑΚΙΝΗΤΟΥ: 4237 | ΠΑΤΡΑ ΠΑΤΡΑ - ΚΕΝΤΡΟ: ΠΩΛΕΙΤΑΙ ΑΝΑΚΑΙΝΙΣΜΕΝΟ ΔΙΑΜΠΕΡΕΣ ΓΡΑΦΕΙΟ 290Τ.Μ. ΠΡΟΣΟΨΕΩΣ ΣΤΟΝ 1Ο ΟΡΟΦΟ ΜΕ ΑΣΑΝΣΕΡ ΜΕ ΑΥΤΟΝΟΜΗ ΘΕΡΜΑΝΣΗ ΡΕΥΜΑΤΟΣ. ΑΠΟΤΕΛΕΙΤΑΙ ΑΠΟ 8 ΧΩΡΟΥΣ 1 ΚΟΥΖΙΝΑ ΑΠΟΘΗΚΗ ΚΑΙ 3 WC ΤΟ ΕΝΑ ΑΜΕΑ. ΕΙΝΑΙ ΚΑΤΑΣΚΕΥΑΣΜΕΝΟ ΤΟ 1990 ΒΑΜΜΕΝΟ ΚΑΙ ΔΙΑΘΕΤΕΙ ΘΕΑ ΣΤΗΝ ΠΟΛΗ ΚΟΥΦΩΜΑΤΑ ΑΛΟΥΜΙΝΙΟΥ ΠΟΡΤΑ ΑΣΦΑΛΕΙΑΣ ΚΛΙΜΑΤΙΣΜΟ ΕΝΕΡΓΕΙΑΚΗ ΚΛΑΣΗ Γ ΔΑΠΕΔΑ ΑΠΟ ΠΛΑΚΑΚΙ. ΤΟ ΑΚΙΝΗΤΟ ΠΡΟΤΕΙΝΕΤΑΙ ΩΣ ΕΠΕΝΔΥΤΙΚΟ. ΤΙΜΗ 530.000€   | ΚΩΔΙΚΟΣ ΑΚΙΝΗΤΟΥ: 4237   ΓΙΑ ΠΕΡΙΣΣΟΤΕΡΕΣ ΦΩΤΟΓΡΑΦΙΕΣ ΤΟΥ ΧΩΡΟΥ ΕΠΙΣΚΕΦΘΕΙΤΕ ΤΗ ΣΕΛΙΔΑ ΜΑΣ. Η ΚΟΥΚΚΙΔΑ ΣΤΟΥΣ ΧΑΡΤΕΣ ΤΟΠΟΘΕΤΕΙΤΑΙ ΚΑΤΑ ΠΡΟΣΕΓΓΙΣΗ.   ΜΕΣΙΤΙΚΟ ΓΡΑΦΕΙΟ «NUEVA CASA» ΔΙΕΥΘΥΝΣΗ: ΠΑΝΤΑΝΑΣΣΗΣ 53 ΠΑΤΡΑ WEBSITE: WWW.NUEVACASA.ESTATE E-MAIL: NUEVA_CASA@OUTLOOK.COM ΤΗΛ. ΕΠΙΚΟΙΝΩΝΙΑΣ: 2614 010 635 ΚΙΝΗΤΟ: 6909 569 549
137,100184,land,Πάτρα,rent,350,Οικόπεδο 900 τ.μ.,Πάτρα Συχαινά: Ενοικιάζεται επικλινές Οικόπεδο 900τ.μ. προσόψεως με συντελεστή κάλυψης 0%. Βρίσκεται σε εμπορική ζώνη είναι κατάλληλο για αγροτική χρήση προτείνεται ως επενδυτικό ακίνητο με ωραία θέα. .Τιμή 350€ | Κωδικός Ακινήτου: 1405 Το στίγμα στον χάρτη είναι ενδεικτικό και αποτυπώνει την ευρύτερη περιοχή. ATALLAS (GREEK COAST) REAL ESTATE Τηλέφωνο Επικοινωνίας: (+30) 2610222005 (+30) 2610424008 Διεύθυνση: Κορίνθου 162 Πάτρα 26223 Ιστοσελίδα: www.greekcoast.gr
138,100318,land,Πάτρα,rent,500,Οικόπεδο 1.800 τ.μ.,ΚΩΔΙΚΟΣ ΑΚΙΝΗΤΟΥ: 4691 | ΠΑΤΡΑ ΣΥΧΑΙΝΑ: ΕΝΟΙΚΙΑΖΕΤΑΙ ΟΙΚΟΠΕΔΟ 1800 Τ.Μ. ΠΡΟΣΟΨΕΩΣ. ΠΕΡΙΕΧΕΙ ΚΤΙΣΜΑ 100 Τ.Μ.. ΑΠΕΧΕΙ 1.5 ΧΛΜ ΑΠΟ ΤΗ ΘΑΛΑΣΣΑ 1.5 ΧΛΜ ΑΠΟ ΠΟΛΗ. ΤΙΜΗ 500€   | ΚΩΔΙΚΟΣ ΑΚΙΝΗΤΟΥ: 4691 ΟΛΑ ΤΑ ΑΚΙΝΗΤΑ ΠΟΥ ΕΧΕΙ ΑΝΑΛΑΒΕΙ ΤΟ ΓΡΑΦΕΙΟ ΜΑΣ ΜΠΟΡΕΙΤΕ ΝΑ ΤΑ ΒΡΕΙΤΕ ΣΥΓΚΕΝΤΡΩΜΕΝΑ ΣΤΟ SITE ΜΑΣ: WWW.NUEVACASA.ESTATE Η ΚΟΥΚΚΙΔΑ ΣΤΟΥΣ ΧΑΡΤΕΣ ΤΟΠΟΘΕΤΕΙΤΑΙ ΚΑΤΑ ΠΡΟΣΕΓΓΙΣΗ Η ΑΚΡΙΒΗΣ ΔΙΕΥΘΥΝΣΗ ΤΟΥ ΑΚΙΝΗΤΟΥ ΔΙΝΕΤΑΙ ΚΑΤΟΠΙΝ ΥΠΟΓΡΑΦΗΣ ΤΗΣ ΕΝΤΟΛΗΣ ΥΠΟΔΕΙΞΕΩΣ ΑΥΤΟΥ ΜΕΣΙΤΙΚΟ ΓΡΑΦΕΙΟ «NUEVA CASA» ΔΙΕΥΘΥΝΣΗ: ΠΑΝΤΑΝΑΣΣΗΣ 53 ΠΑΤΡΑ WEBSITE: WWW.NUEVACASA.ESTATE E-MAIL: NUEVA_CASA@OUTLOOK.COM ΤΗΛ. ΕΠΙΚΟΙΝΩΝΙΑΣ: 2614 010 635 ΚΙΝΗΤΟ: 6909 569 549
139,100365,land,Πάτρα,rent,5000,Οικόπεδο 8.000 τ.μ.,ΚΩΔΙΚΟΣ ΑΚΙΝΗΤΟΥ: 2525 | ΠΑΤΡΑ ΕΓΛΥΚΑΔΑ: ΕΝΟΙΚΙΑΖΕΤΑΙ ΔΙΑΜΠΕΡΕΣ ΟΙΚΟΠΕΔΟ 8000Τ.Μ. ΠΡΟΣΟΨΕΩΣ ΜΕ ΣΥΝΤΕΛΕΣΤΗ ΔΟΜΗΣΗΣ 0.8 ΠΟΣΟΣΤΟ ΚΑΛΥΨΗΣ 40% ΥΨΟΣ 1050 ΜΕΤΡΑ (ΧΤΙΖΕΙ 3 ΟΡΟΦΟΥΣ). ΠΕΡΙΕΧΕΙ ΚΤΙΣΜΑ ΒΡΙΣΚΕΤΑΙ ΣΕ ΟΙΚΙΣΤΙΚΗ ΠΕΡΙΟΧΗ ΠΡΟΤΕΙΝΕΤΑΙ ΩΣ ΕΠΕΝΔΥΤΙΚΟ ΑΚΙΝΗΤΟ ΜΕ ΩΡΑΙΑ ΘΕΑ. ΤΙΜΗ 5.000€   | ΚΩΔΙΚΟΣ ΑΚΙΝΗΤΟΥ: 2525   Η ΚΟΥΚΚΙΔΑ ΣΤΟΥΣ ΧΑΡΤΕΣ ΤΟΠΟΘΕΤΕΙΤΑΙ ΚΑΤΑ ΠΡΟΣΕΓΓΙΣΗ.   ΜΕΣΙΤΙΚΟ ΓΡΑΦΕΙΟ «NUEVA CASA» ΔΙΕΥΘΥΝΣΗ: ΠΑΝΤΑΝΑΣΣΗΣ 53 ΠΑΤΡΑ WEBSITE: WWW.NUEVACASA.ESTATE E-MAIL: NUEVA_CASA@OUTLOOK.COM ΤΗΛ. ΕΠΙΚΟΙΝΩΝΙΑΣ: 2614 010 635 ΚΙΝΗΤΟ: 6909 569 549 -
140,100339,land,Πάτρα,rent,450,Αγροτεμάχιο 600 τ.μ.,Πάτρα Περιβόλα: Ενοικιάζεται επίπεδοΑγροτεμάχιο 600τ.μ. προσόψεως. Βρίσκεται σε εμπορική ζώνη είναι κατάλληλο για αγροτική χρήση με θέα το βουνό. Απέχει 4 χλμ από τη θάλασσα 15 χλμ από χωριό 35 χλμ από αεροδρόμιο 3 χλμ από πόλη.Τιμή 450€ | Κωδικός Ακινήτου: 26086 Κτηματομεσιτικό γραφείο Αγγελόπουλος ? Τσεκούρας AT Real Estate Website : www.atrealestate.gr Tip : Για την καλύτερη εξυπηρέτηση σας χρησιμοποιείστε τον κωδικό ακινήτου που αναγράφεται στην περιγραφή Η διεύθυνση στον χάρτη είναι κατά προσέγγιση και η ακριβή διεύθυνση δίνεται κατά την υπόδειξη του ακινήτου . Για περισσότερα ακίνητα και πληροφορίες επισκεφθείτε την ηλεκτρονική μας ιστοσελίδα . Επικοινωνήστε μαζί μας : Website : www.atrealestate.gr E-mail: info@atrealestate.gr  info@libertypatra.gr Τηλέφωνο : 2610-620180 & 2610-226723
141,100170,land,Πάτρα,rent,6000,Οικόπεδο 20.000 τ.μ.,ΚΩΔΙΚΟΣ ΑΚΙΝΗΤΟΥ: 13676 | ΠΑΤΡΑ Β.Ι.Ο.ΠΑ: ΕΝΟΙΚΙΑΖΕΤΑΙ ΔΙΑΜΠΕΡΕΣ ΓΩΝΙΑΚΟ ΕΠΙΠΕΔΟΟΙΚΟΠΕΔΟ 20000Τ.Μ. ΠΡΟΣΟΨΕΩΣ. ΒΡΙΣΚΕΤΑΙ ΣΕ ΒΙΟΜΗΧΑΝΙΚΗ ΖΩΝΗ ΠΡΟΤΕΙΝΕΤΑΙ ΩΣ ΕΠΕΝΔΥΤΙΚΟ ΑΚΙΝΗΤΟ ΜΕ ΩΡΑΙΑ ΘΕΑ. ΑΠΕΧΕΙ 2 ΧΛΜ ΑΠΟ ΤΗ ΘΑΛΑΣΣΑ.ΤΙΜΗ 6.000€ | ΚΩΔΙΚΟΣ ΑΚΙΝΗΤΟΥ: 13676 ΑΚΙΝΗΤΑ ΑΠΟΚΛΕΙΣΤΙΚΗΣ ΔΙΑΘΕΣΗΣ ΜΕ ΦΩΤΟΓΡΑΦΙΕΣ ΠΟΥ ΔΙΑΧΕΙΡΙΖΕΤΑΙ Η ΕΤΑΙΡΙΑ ΜΑΣ ΘΑ ΒΡΕΙΤΕ ΣΤΗΝ ΙΣΤΟΣΕΛΙΔΑ ΜΑΣ. WEBSITE: www.tzelirealestate.gr ΓΙΑ ΤΗΝ ΚΑΛΥΤΕΡΗ ΕΞΥΠΗΡΕΤΗΣΗ ΣΑΣ ΧΡΗΣΙΜΟΠΟΙΕΙΣΤΕ ΤΟΝ ΚΩΔΙΚΟ ΑΚΙΝΗΤΟΥ ΠΟΥ ΑΝΑΓΡΑΦΕΤΑΙ ΣΤΗΝ ΠΕΡΙΓΡΑΦΗ. Η ΔΙΕΥΘΥΝΣΗ ΣΤΟΝ ΧΑΡΤΗ ΕΧΕΙ ΤΟΠΟΘΕΤΗΘΕΙ ΚΑΤΑ ΠΡΟΣΕΓΓΙΣΗ. ΟΙ ΑΚΡΙΒΕΙΣ ΠΛΗΡΟΦΟΡΙΕΣ ΤΗΣ ΔΙΕΥΘΥΝΣΗΣ ΠΑΡΕΧΟΝΤΑΙ ΣΤΗΝ ΥΠΟΔΕΙΞΗ ΤΟΥ ΑΚΙΝΗΤΟΥ.
142,100066,land,Patra,rent,650,Οικόπεδο 800 τ.μ.,Πάτρα Μεταμόρφωση: Ενοικιάζεται διαμπερές γωνιακό Οικόπεδο 800τ.μ. πρόσοψης. Απέχει 1.5 χλμ από τη θάλασσα 10 χλμ από χωριό 35 χλμ από αεροδρόμιο 4 χλμ από πόλη.Τιμή 650€ | Κωδικός Ακινήτου: 20766 ΚΤΗΜΑΤΟΜΕΣΙΤΙΚΕΣ ΥΠΗΡΕΣΙΕΣ ΑΓΓΕΛΟΠΟΥΛΟΣ-ΤΣΕΚΟΥΡΑΣAT REAL ESTATE  ΔΙΕΥΘΥΝΣΗ: ΑΡΑΤΟΥ 28 ΠΑΤΡΑΙΣΟΓΕΙΟ ΚΑΤΑΣΤΗΜΑ. ΤΗΛΕΦΩΝΟ ΕΠΙΚΟΙΝΩΝΙΑΣ : 2610-620180 FAX: 2610-620735  EMAIL: info@libertypatra.gr ΓΙΑ ΠΕΡΙΣΣΟΤΕΡΑ ΑΚΙΝΗΤΑ ΚΑΙ ΠΛΗΡΟΦΟΡΙΕΣ ΕΠΙΣΚΕΦΘΕΙΤΕ ΤΗΝ ΗΛΕΚΤΡΟΚΙΝΗ ΜΑΣ ΣΕΛΙΔΑ ΣΤΗΝ ΔΙΕΥΘΥΝΣΗ : www.atrealestate.gr
143,100028,land,Πάτρα,rent,1000,Οικόπεδο 2.000 τ.μ.,ΠΕΡΙΟΧΗ ΒΙ.Ο.ΠΑ:Γωνιακό διαμπερές περιφραγμένο οικόπεδο συνολικού εμβαδού 2000. Κατάλληλο για επαγγελματικό χώρο . ΚΤΗΜΑΤΟΜΕΣΙΤΙΚΕΣ ΥΠΗΡΕΣΙΕΣ ΑΓΓΕΛΟΠΟΥΛΟΣ-ΤΣΕΚΟΥΡΑΣAT REAL ESTATE  ΔΙΕΥΘΥΝΣΗ: ΑΡΑΤΟΥ 28 ΠΑΤΡΑΙΣΟΓΕΙΟ ΚΑΤΑΣΤΗΜΑ. ΤΗΛΕΦΩΝΟ ΕΠΙΚΟΙΝΩΝΙΑΣ : 2610-620180 FAX: 2610-620735  EMAIL: info@libertypatra.gr ΓΙΑ ΠΕΡΙΣΣΟΤΕΡΑ ΑΚΙΝΗΤΑ ΚΑΙ ΠΛΗΡΟΦΟΡΙΕΣ ΕΠΙΣΚΕΦΘΕΙΤΕ ΤΗΝ ΗΛΕΚΤΡΟΚΙΝΗ ΜΑΣ ΣΕΛΙΔΑ ΣΤΗΝ ΔΙΕΥΘΥΝΣΗ : www.atrealestate.gr youtube Διαμόρφωση χώρων Ένας χώρος Εντός οικισμού Κατάσταση Καλή Περιφραγμένο Πλησίον Αγορά Πλησίον Εκκλησία Πλησίον Σχολεία Πλησίον Στάση Αστικής Συγκοινωνίας Προσανατολισμός Γωνιακό Πρόσβαση από Άσφαλτο
144,100280,land,Πάτρα,rent,500,Οικόπεδο 465 τ.μ.,Πάτρα Λεύκα: Ενοικιάζεται επίπεδοΟικόπεδο 465τ.μ. προσόψεως. Βρίσκεται σε εμπορική ζώνηΑπέχει 2 χλμ από τη θάλασσα 15 χλμ από χωριό 35 χλμ από αεροδρόμιο 2 χλμ από πόλη.Τιμή 500€ | Κωδικός Ακινήτου: 24429 Κτηματομεσιτικό γραφείο Αγγελόπουλος ? Τσεκούρας AT Real Estate Website : www.atrealestate.gr Tip : Για την καλύτερη εξυπηρέτηση σας χρησιμοποιείστε τον κωδικό ακινήτου που αναγράφεται στην περιγραφή Η διεύθυνση στον χάρτη είναι κατά προσέγγιση και η ακριβή διεύθυνση δίνεται κατά την υπόδειξη του ακινήτου . Για περισσότερα ακίνητα και πληροφορίες επισκεφθείτε την ηλεκτρονική μας ιστοσελίδα . Επικοινωνήστε μαζί μας : Website : www.atrealestate.gr E-mail: info@atrealestate.gr  info@libertypatra.gr Τηλέφωνο : 2610-620180 & 2610-226723
