ad_id,publisher_id,type,location,purpose,price,title,description
1,100289,residence,Πάτρα,rent,400,Διαμέρισμα 78 τ.μ.,τριάρι μπάνιο και κουζίνα όχι πετρέλαιο. στην οδο Κολοκοτρώνη 32 στην πλατεία Όλγας
2,100277,residence,Πάτρα,rent,580,Διαμέρισμα 58 τ.μ.,μπαλκονόπορτες με διπλή ενεργειακή θωράκιση για ηχομόνωση και θερμομόνωση. Ευρύχωρο φωτεινότατο έναντι διατηρητέου κτιρίου και αρχαιολογικού χώρου στην κεντρική πλατεία Υψηλών Αλωνίων στην Πάτρα. Πλησίον Αγοράς Υπηρεσιών Τραπεζών και εστίασης. Με βασικό πλεονέκτημα την εξοικονόμηση ενέργειας και πλήρη ριζική ανακατασκευή που έχει ολοκληρωθεί πρόσφατα. Για την ενοικίαση ζητείται η καταβολή μισθωμάτων έτους και εγγύησης
3,100479,residence,Πάτρα,rent,385,Διαμέρισμα 42 τ.μ.,κεντρικό πλησίον Αγ. Διονυσίου με ιδιαίτερα χαρακτηριστικά διακόσμησης πλήρως εξοπλισμένο με ηλεκτρικές συσκευές σύγχρονη κουζίνα με ελαστική μπαταρία νεροχύτη ρελέ ασφαλείας εντοιχιζόμενη ντουλάπα και φωτισμό led διαθέτει στεγασμένη θέση στάθμευσης με ισχυρή γκαραζόπορτα τηλεχειρισμού σύστημα εξωτερικό φωτισμό νύχτας και κίνηση led και αυλή με κήπο διατίθεται το ελάχιστο για ένα χρόνο και με προκαταβλητέα τα μισθώματα συν την εγγύηση
4,100122,residence,Πάτρα,rent,750,Διαμέρισμα 80 τ.μ.,ΑΡΟΗ Πολυτελές ρετιρέ διαμέρισμα 80 τ. μ. αποπερατωμένο Αύγουστος 2022 σύγχρονο μινιμαλιστικό design νέες εντοιχισμένες ηλεκτρικές συσκευές υψηλής αισθητικής και ποιότητας μοναδική απεριόριστη πανοραμική θέα στον Πατραϊκό μεγάλη βεράντα διατίθεται πρώτη φορά για κατοίκηση ιδανικό για ζευγάρι με ένα ή δύο παιδιά με προοπτική μακρόχρονης μίσθωσης
5,100437,residence,Πάτρα,rent,900,Διαμέρισμα 100 τ.μ.,Πελεκάνος μαρίνα φατσα θάλασσα 2 μπανια μεγαλο σαλονι μεγαλες βεραντες απεριοριστη θεα θαλασσα. Ηρωων πολυτεχνειου 88
6,100263,residence,Πάτρα,rent,280,Διαμέρισμα 56 τ.μ.,Πλησίον Πλατείας Παπανδρέου ενοικιάζεται 2άρι 56 τ.μ. 1ου ορόφου κατασκευής 2008 με 1υ/δ σαλόνι και αυτόνομη κουζίνα διαμπερές Α/Θ διπλά τζάμια.γιά άμεση εξυπηρέτηση 6946454306
7,100193,residence,Πάτρα,rent,400,Διαμέρισμα 32 τ.μ.,ΠΑΤΡΑ νεόδμητο studio 32 τ. μ.  1 ου 1 υ/δ κατασκευή '08  μπάνιο επιπλωμένο θέρμανση: αυτόνομη θέρμανση κλιματισμός απεριόριστη θέα πάρκινγκ πιλοτής ελεύθερο Ενοικιάζεται γκαρσονιέρα - studio στον πρώτο όροφο 32 τ. μ.  στο μέσο της απόστασης μεταξύ κέντρου Πάτρας και Πανεπιστημίου. Στα 50 μ. υπάρχει στάση λεωφορείου καθώς και μαγαζιά (super market φούρνος φαρμακείο ψησταριά κομμωτήριο κουρείο ψησταριά ζαχαροπλαστείο κ. λ. π. ). Το διαμέρισμα είναι πλήρως επιπλωμένο με καινούργια έπιπλα και ηλεκτρικές συσκευές (ψυγείο κουζινάκι πλυντήριο τηλεόραση). Θέρμανση - ψύξη με καινούργιο air condition inverter έχει θέση πάρκινγκ στην πιλοτή για μικρό ή μεσαίο αυτοκίνητο. Βρίσκεται σε διώροφο κτίριο με αίθριο. Μεγάλη βεράντα με όμορφη θέα και είναι πολύ φωτεινό και ζεστό γιατί είναι ανατολικομεσημβρινό. Είναι καλαίσθητα επιπλωμένο με έπιπλα που αγοράστηκαν για το ίδιο και όχι περισσεύματα από άλλα σπίτια. Έχει επίσης χαλιά που δεν φαίνονται στις φωτογραφίες καθώς και όλα τα κουζινικά σκεύη. Ανακαινίστηκε πλήρως τον Σεπτέμβριο του 2021.
8,100471,residence,Πάτρα,rent,400,Διαμέρισμα 85 τ.μ.,επιπλωμένο ή άνευ επίπλων σαλόνι κουζίνα τραπεζαρία μπάνιο και αυτόνομη θέρμανση. Πολύ καλή κατασκευή
9,100256,residence,Πάτρα,rent,450,Μονοκατοικία 60 τ.μ.,ΚΩΔΙΚΟΣ ΑΚΙΝΗΤΟΥ: 22756 | ΠΑΤΡΑ ΠΡΟΑΣΤΙΟ: ΕΝΟΙΚΙΑΖΕΤΑΙ ΔΙΑΜΠΕΡΗΣ ΜΟΝΟΚΑΤΟΙΚΙΑ 60Τ.Μ. ΣΕ 100Τ.Μ. ΟΙΚΟΠΕΔΟ ΜΕ ΑΥΤΟΝΟΜΗ ΘΕΡΜΑΝΣΗ ΠΕΤΡΕΛΑΙΟΥ. ΑΠΟΤΕΛΕΙΤΑΙ ΑΠΟ 2 ΥΠΝΟΔΩΜΑΤΙΑ 1 ΚΟΥΖΙΝΑ 1 ΣΑΛΟΝΙ ΚΑΙ ΜΠΑΝΙΟ. ΕΙΝΑΙ ΠΛΗΡΩΣ ΕΠΙΠΛΩΜΕΝΗ ΕΞΟΠΛΙΣΜΕΝΗ ΜΕ ΗΛΕΚΤΡΙΚΕΣ ΣΥΣΚΕΥΕΣ ΚΑΤΑΣΚΕΥΑΣΜΕΝΗ ΤΟ 1985 ΒΑΜΜΕΝΗ ΚΑΙ ΔΙΑΘΕΤΕΙ ΩΡΑΙΑ ΘΕΑ ΚΟΥΦΩΜΑΤΑ ΑΛΟΥΜΙΝΙΟΥ ΜΕ ΔΙΠΛΑ ΤΖΑΜΙΑ ΕΞΩΤΕΡΙΚΗ ΘΕΣΗ ΣΤΑΘΜΕΥΣΗΣ ΚΛΙΜΑΤΙΣΜΟ ΔΑΠΕΔΑ ΑΠΟ ΜΑΡΜΑΡΟ. ΕΙΝΑΙ ΙΔΑΝΙΚΗ ΓΙΑ ΦΟΙΤΗΤΕΣ ΧΩΡΙΣ ΜΗΝΙΑΙΑ ΚΟΙΝΟΧΡΗΣΤΑ ΚΑΙ ΕΠΙΤΡΕΠΟΝΤΑΙ ΤΑ ΚΑΤΟΙΚΙΔΙΑ.     ΤΙΜΗ 450€ | ΚΩΔΙΚΟΣ ΑΚΙΝΗΤΟΥ: 22756 ΑΚΙΝΗΤΑ ΑΠΟΚΛΕΙΣΤΙΚΗΣ ΔΙΑΘΕΣΗΣ ΜΕ ΦΩΤΟΓΡΑΦΙΕΣ ΠΟΥ ΔΙΑΧΕΙΡΙΖΕΤΑΙ Η ΕΤΑΙΡΙΑ ΜΑΣ ΘΑ ΒΡΕΙΤΕ ΣΤΗΝ ΙΣΤΟΣΕΛΙΔΑ ΜΑΣ. WEBSITE: www.tzelirealestate.gr ΓΙΑ ΤΗΝ ΚΑΛΥΤΕΡΗ ΕΞΥΠΗΡΕΤΗΣΗ ΣΑΣ ΧΡΗΣΙΜΟΠΟΙΕΙΣΤΕ ΤΟΝ ΚΩΔΙΚΟ ΑΚΙΝΗΤΟΥ ΠΟΥ ΑΝΑΓΡΑΦΕΤΑΙ ΣΤΗΝ ΠΕΡΙΓΡΑΦΗ. Η ΔΙΕΥΘΥΝΣΗ ΣΤΟΝ ΧΑΡΤΗ ΕΧΕΙ ΤΟΠΟΘΕΤΗΘΕΙ ΚΑΤΑ ΠΡΟΣΕΓΓΙΣΗ. ΟΙ ΑΚΡΙΒΕΙΣ ΠΛΗΡΟΦΟΡΙΕΣ ΤΗΣ ΔΙΕΥΘΥΝΣΗΣ ΠΑΡΕΧΟΝΤΑΙ ΣΤΗΝ ΥΠΟΔΕΙΞΗ ΤΟΥ ΑΚΙΝΗΤΟΥ.
10,100458,residence,Πάτρα,rent,450,Διαμέρισμα 52 τ.μ.,ΚΩΔΙΚΟΣ ΑΚΙΝΗΤΟΥ: 22757 | ΠΑΤΡΑ ΥΨΗΛΑ ΑΛΩΝΙΑ: ΕΝΟΙΚΙΑΖΕΤΑΙ ΝΕΟΔΜΗΤΟ ΓΩΝΙΑΚΟ ΔΙΑΜΕΡΙΣΜΑ 52Τ.Μ. ΠΡΟΣΟΨΕΩΣ ΣΤΟΝ 5 ΟΡΟΦΟ ΜΕ ΑΣΑΝΣΕΡ ΜΕ ΑΥΤΟΝΟΜΗ ΘΕΡΜΑΝΣΗ ΠΕΤΡΕΛΑΙΟΥ. ΑΠΟΤΕΛΕΙΤΑΙ ΑΠΟ 1 ΥΠΝΟΔΩΜΑΤΙΟ 1 ΚΟΥΖΙΝΑ 1 ΣΑΛΟΝΙ ΚΑΙ ΜΠΑΝΙΟ. ΕΙΝΑΙ ΚΑΤΑΣΚΕΥΑΣΜΕΝΟ ΤΟ 2008 ΒΑΜΜΕΝΟ ΚΑΙ ΔΙΑΘΕΤΕΙ ΩΡΑΙΑ ΘΕΑ ΚΟΥΦΩΜΑΤΑ ΑΛΟΥΜΙΝΙΟΥ ΜΕ ΔΙΠΛΑ ΤΖΑΜΙΑ ΠΟΡΤΑ ΑΣΦΑΛΕΙΑΣ ΚΛΙΜΑΤΙΣΜΟ ΔΑΠΕΔΑ ΑΠΟ ΠΛΑΚΑΚΙ ΗΛΙΑΚΟ ΘΕΡΜΟΣΙΦΩΝΑ. ΕΙΝΑΙ ΙΔΑΝΙΚΟ ΓΙΑ ΦΟΙΤΗΤΕΣ. ΕΠΙΠΛΕΟΝ ΧΑΡΑΚΤΗΡΙΣΤΙΚΑ: ΘΥΡΟΤΗΛΕΟΡΑΣΗ. ΔΙΝΕΤΑΙ ΕΠΙΠΛΩΜΕΝΟ-ΕΞΟΠΛΙΣΜΕΝΟ ΣΤΑ 500€.     ΤΙΜΗ 450€ | ΚΩΔΙΚΟΣ ΑΚΙΝΗΤΟΥ: 22757 ΑΚΙΝΗΤΑ ΑΠΟΚΛΕΙΣΤΙΚΗΣ ΔΙΑΘΕΣΗΣ ΜΕ ΦΩΤΟΓΡΑΦΙΕΣ ΠΟΥ ΔΙΑΧΕΙΡΙΖΕΤΑΙ Η ΕΤΑΙΡΙΑ ΜΑΣ ΘΑ ΒΡΕΙΤΕ ΣΤΗΝ ΙΣΤΟΣΕΛΙΔΑ ΜΑΣ. WEBSITE: www.tzelirealestate.gr ΓΙΑ ΤΗΝ ΚΑΛΥΤΕΡΗ ΕΞΥΠΗΡΕΤΗΣΗ ΣΑΣ ΧΡΗΣΙΜΟΠΟΙΕΙΣΤΕ ΤΟΝ ΚΩΔΙΚΟ ΑΚΙΝΗΤΟΥ ΠΟΥ ΑΝΑΓΡΑΦΕΤΑΙ ΣΤΗΝ ΠΕΡΙΓΡΑΦΗ. Η ΔΙΕΥΘΥΝΣΗ ΣΤΟΝ ΧΑΡΤΗ ΕΧΕΙ ΤΟΠΟΘΕΤΗΘΕΙ ΚΑΤΑ ΠΡΟΣΕΓΓΙΣΗ. ΟΙ ΑΚΡΙΒΕΙΣ ΠΛΗΡΟΦΟΡΙΕΣ ΤΗΣ ΔΙΕΥΘΥΝΣΗΣ ΠΑΡΕΧΟΝΤΑΙ ΣΤΗΝ ΥΠΟΔΕΙΞΗ ΤΟΥ ΑΚΙΝΗΤΟΥ.
11,100057,residence,Πάτρα,rent,370,Διαμέρισμα 35 τ.μ.,ΚΩΔΙΚΟΣ ΑΚΙΝΗΤΟΥ: 22750 | ΠΑΤΡΑ ΥΨΗΛΑ ΑΛΩΝΙΑ: ΕΝΟΙΚΙΑΖΕΤΑΙ ΠΛΗΡΩΣ ΑΝΑΚΑΙΝΙΣΜΕΝΗ ΔΙΑΜΠΕΡΗΣ ΓΚΑΡΣΟΝΙΕΡΑ 35Τ.Μ. ΣΤΟΝ 6 ΟΡΟΦΟ ΜΕ ΑΣΑΝΣΕΡ ΜΕ ΑΥΤΟΝΟΜΗ ΘΕΡΜΑΝΣΗ ΡΕΥΜΑΤΟΣ. ΑΠΟΤΕΛΕΙΤΑΙ ΑΠΟ 1 ΥΠΝΟΔΩΜΑΤΙΟ 1 ΚΟΥΖΙΝΑ ΚΑΙ ΜΠΑΝΙΟ. ΕΙΝΑΙ ΠΛΗΡΩΣ ΕΠΙΠΛΩΜΕΝΗ ΕΞΟΠΛΙΣΜΕΝΗ ΜΕ ΗΛΕΚΤΡΙΚΕΣ ΣΥΣΚΕΥΕΣ ΚΑΤΑΣΚΕΥΑΣΜΕΝΗ ΤΟ 1980 ΒΑΜΜΕΝΗ ΚΑΙ ΔΙΑΘΕΤΕΙ ΩΡΑΙΑ ΘΕΑ ΚΟΥΦΩΜΑΤΑ ΑΛΟΥΜΙΝΙΟΥ ΜΕ ΔΙΠΛΑ ΤΖΑΜΙΑ ΠΟΡΤΑ ΑΣΦΑΛΕΙΑΣ ΚΛΙΜΑΤΙΣΜΟ ΔΑΠΕΔΑ ΑΠΟ ΠΛΑΚΑΚΙ ΤΕΝΤΕΣ. ΕΙΝΑΙ ΙΔΑΝΙΚΗ ΓΙΑ ΦΟΙΤΗΤΕΣ.     ΤΙΜΗ 370€ | ΚΩΔΙΚΟΣ ΑΚΙΝΗΤΟΥ: 22750 ΑΚΙΝΗΤΑ ΑΠΟΚΛΕΙΣΤΙΚΗΣ ΔΙΑΘΕΣΗΣ ΜΕ ΦΩΤΟΓΡΑΦΙΕΣ ΠΟΥ ΔΙΑΧΕΙΡΙΖΕΤΑΙ Η ΕΤΑΙΡΙΑ ΜΑΣ ΘΑ ΒΡΕΙΤΕ ΣΤΗΝ ΙΣΤΟΣΕΛΙΔΑ ΜΑΣ. WEBSITE: www.tzelirealestate.gr ΓΙΑ ΤΗΝ ΚΑΛΥΤΕΡΗ ΕΞΥΠΗΡΕΤΗΣΗ ΣΑΣ ΧΡΗΣΙΜΟΠΟΙΕΙΣΤΕ ΤΟΝ ΚΩΔΙΚΟ ΑΚΙΝΗΤΟΥ ΠΟΥ ΑΝΑΓΡΑΦΕΤΑΙ ΣΤΗΝ ΠΕΡΙΓΡΑΦΗ. Η ΔΙΕΥΘΥΝΣΗ ΣΤΟΝ ΧΑΡΤΗ ΕΧΕΙ ΤΟΠΟΘΕΤΗΘΕΙ ΚΑΤΑ ΠΡΟΣΕΓΓΙΣΗ. ΟΙ ΑΚΡΙΒΕΙΣ ΠΛΗΡΟΦΟΡΙΕΣ ΤΗΣ ΔΙΕΥΘΥΝΣΗΣ ΠΑΡΕΧΟΝΤΑΙ ΣΤΗΝ ΥΠΟΔΕΙΞΗ ΤΟΥ ΑΚΙΝΗΤΟΥ.
12,100011,residence,Πάτρα,rent,280,Διαμέρισμα 28 τ.μ.,Σμύρνης και Εφέσσου εξωτερική θερμομόνωση ενσύρματο ίντερνετ κουφώματα αλουμινίου μπόιλερ νυχτερινό ρεύμα μόλις 10 λ. με τα πόδια από το κέντρο της πόλης ιδιώτης
13,100276,residence,Πάτρα,rent,250,Διαμέρισμα 30 τ.μ.,ΚΩΔΙΚΟΣ ΑΚΙΝΗΤΟΥ: 22717 | ΠΑΤΡΑ Κ.Ε.Τ.Χ: ΕΝΟΙΚΙΑΖΕΤΑΙ ΓΚΑΡΣΟΝΙΕΡΑ 30Τ.Μ. ΣΤΟΝ 1 ΟΡΟΦΟ ΜΕ ΑΣΑΝΣΕΡ ΜΕ ΑΥΤΟΝΟΜΗ ΘΕΡΜΑΝΣΗ ΠΕΤΡΕΛΑΙΟΥ. ΑΠΟΤΕΛΕΙΤΑΙ ΑΠΟ 1 ΥΠΝΟΔΩΜΑΤΙΟ 1 ΚΟΥΖΙΝΑ ΚΑΙ ΜΠΑΝΙΟ. ΕΙΝΑΙ ΠΛΗΡΩΣ ΕΠΙΠΛΩΜΕΝΗ ΕΞΟΠΛΙΣΜΕΝΗ ΜΕ ΗΛΕΚΤΡΙΚΕΣ ΣΥΣΚΕΥΕΣ ΚΑΤΑΣΚΕΥΑΣΜΕΝΗ ΤΟ 2006 ΚΑΙ ΔΙΑΘΕΤΕΙ ΚΟΥΦΩΜΑΤΑ ΑΛΟΥΜΙΝΙΟΥ ΜΕ ΔΙΠΛΑ ΤΖΑΜΙΑ ΠΟΡΤΑ ΑΣΦΑΛΕΙΑΣ ΚΛΙΜΑΤΙΣΜΟ ΔΑΠΕΔΑ ΑΠΟ ΠΛΑΚΑΚΙ. ΕΙΝΑΙ ΙΔΑΝΙΚΗ ΓΙΑ ΦΟΙΤΗΤΕΣ ΜΕ ΕΛΑΧΙΣΤΑ ΚΟΙΝΟΧΡΗΣΤΑ. ΕΠΙΠΛΕΟΝ ΧΑΡΑΚΤΗΡΙΣΤΙΚΑ: ΘΥΡΟΤΗΛΕΟΡΑΣΗ.     ΤΙΜΗ 250€ | ΚΩΔΙΚΟΣ ΑΚΙΝΗΤΟΥ: 22717 ΑΚΙΝΗΤΑ ΑΠΟΚΛΕΙΣΤΙΚΗΣ ΔΙΑΘΕΣΗΣ ΜΕ ΦΩΤΟΓΡΑΦΙΕΣ ΠΟΥ ΔΙΑΧΕΙΡΙΖΕΤΑΙ Η ΕΤΑΙΡΙΑ ΜΑΣ ΘΑ ΒΡΕΙΤΕ ΣΤΗΝ ΙΣΤΟΣΕΛΙΔΑ ΜΑΣ. WEBSITE: www.tzelirealestate.gr ΓΙΑ ΤΗΝ ΚΑΛΥΤΕΡΗ ΕΞΥΠΗΡΕΤΗΣΗ ΣΑΣ ΧΡΗΣΙΜΟΠΟΙΕΙΣΤΕ ΤΟΝ ΚΩΔΙΚΟ ΑΚΙΝΗΤΟΥ ΠΟΥ ΑΝΑΓΡΑΦΕΤΑΙ ΣΤΗΝ ΠΕΡΙΓΡΑΦΗ. Η ΔΙΕΥΘΥΝΣΗ ΣΤΟΝ ΧΑΡΤΗ ΕΧΕΙ ΤΟΠΟΘΕΤΗΘΕΙ ΚΑΤΑ ΠΡΟΣΕΓΓΙΣΗ. ΟΙ ΑΚΡΙΒΕΙΣ ΠΛΗΡΟΦΟΡΙΕΣ ΤΗΣ ΔΙΕΥΘΥΝΣΗΣ ΠΑΡΕΧΟΝΤΑΙ ΣΤΗΝ ΥΠΟΔΕΙΞΗ ΤΟΥ ΑΚΙΝΗΤΟΥ.
14,100064,residence,Πάτρα,rent,240,Διαμέρισμα 39 τ.μ.,Κωδ.: 85-589 - ΨΑΧΟΥ - Πάτρα (Αχαΐα) Ενοικίαση - Δίχωρη Γκαρσονιέρα (Κατοικίες) 3900 m² Υπνοδωμάτια: 1 Όροφος: Ημιώροφος Τύπος Θέρμανσης: Αυτόνομη με Ρεύμα Έτος Κατασκευής: 1985 Πολύ Καλή Κατάσταση. Φοιτητική Κατοικία- Κατάλληλη και για Ζευγάρι- Εργαζόμενους. Πολύ Φωτεινό Κουφώματα Αλουμινίου Συρόμενα Διπλά Τζάμια Δάπεδο Μάρμαρο Εντοιχιζόμενη Ντουλάπα μεγάλης χωρητικότητας Βεράντα Πρόσοψης Τέντα Πατάρι Αποθήκευσης Ελάχιστα Κοινόχρηστα Εύκολη πρόσβαση στο κέντρο της πόλης - Ήσυχη και προσεγμένη περιοχή. Κοντά σε Στάση Λεωφορείου για Κέντρο και ΤΕΙ Κοντά σε Αρτοποιεία Καταστήματα Εστίασης και Εμπορικά Super Market Φαρμακεία Σχολεία. Το ακίνητο διατίθεται ΕΠΙΠΛΩΜΕΝΟ και ΜΕ τον ηλεκτρικό εξοπλισμό όπως φαίνεται στις φωτογραφίες . Αποστάσεις: 2800μ από Πλατεία Γεωργίου Α (κέντρο Πάτρας) 1700μ από Νοσοκομείο Άγιος Ανδρέας 1400μ από ΤΕΙ Πατρών. Γι αυτή την αγγελία επικοινωνήστε στο τηλέφωνο: 2613014674. Η πινέζα στον χάρτη έχει τοποθετηθεί κατά προσέγγιση για ευνόητους λόγους. Οι ακριβείς πληροφορίες της τοποθεσίας παρέχονται μετά την επιβεβαίωση της συνάντησης. Τιμή: 240€. Κωδικός: 85-589 . ΔΕΙΤΕ ΤΟ ΒΙΝΤΕΟ.
15,100274,residence,Πάτρα,rent,250,Διαμέρισμα 35 τ.μ.,ΚΩΔΙΚΟΣ ΑΚΙΝΗΤΟΥ: 22731 | ΠΑΤΡΑ ΠΑΤΡΑ - ΚΕΝΤΡΟ: ΕΝΟΙΚΙΑΖΕΤΑΙ ΔΙΑΜΠΕΡΗΣ ΓΚΑΡΣΟΝΙΕΡΑ 35Τ.Μ. ΣΤΟΝ 3 ΟΡΟΦΟ ΜΕ ΑΣΑΝΣΕΡ ΜΕ ΚΕΝΤΡΙΚΗ ΘΕΡΜΑΝΣΗ ΠΕΤΡΕΛΑΙΟΥ. ΑΠΟΤΕΛΕΙΤΑΙ ΑΠΟ 1 ΥΠΝΟΔΩΜΑΤΙΟ 1 ΚΟΥΖΙΝΑ ΚΑΙ ΜΠΑΝΙΟ. ΕΙΝΑΙ ΕΞΟΠΛΙΣΜΕΝΗ ΚΑΤΑΣΚΕΥΑΣΜΕΝΗ ΤΟ 1980 ΚΑΙ ΔΙΑΘΕΤΕΙ ΩΡΑΙΑ ΘΕΑ ΔΑΠΕΔΑ ΑΠΟ ΜΩΣΑΙΚΟ & ΞΥΛΟ. ΕΙΝΑΙ ΙΔΑΝΙΚΗ ΓΙΑ ΦΟΙΤΗΤΕΣ. ΕΠΙΠΛΕΟΝ ΧΑΡΑΚΤΗΡΙΣΤΙΚΑ: ΠΑΤΑΡΙ ΑΠΟΘΗΚΕΥΣΗΣ.     ΤΙΜΗ 250€ | ΚΩΔΙΚΟΣ ΑΚΙΝΗΤΟΥ: 22731 ΑΚΙΝΗΤΑ ΑΠΟΚΛΕΙΣΤΙΚΗΣ ΔΙΑΘΕΣΗΣ ΜΕ ΦΩΤΟΓΡΑΦΙΕΣ ΠΟΥ ΔΙΑΧΕΙΡΙΖΕΤΑΙ Η ΕΤΑΙΡΙΑ ΜΑΣ ΘΑ ΒΡΕΙΤΕ ΣΤΗΝ ΙΣΤΟΣΕΛΙΔΑ ΜΑΣ. WEBSITE: www.tzelirealestate.gr ΓΙΑ ΤΗΝ ΚΑΛΥΤΕΡΗ ΕΞΥΠΗΡΕΤΗΣΗ ΣΑΣ ΧΡΗΣΙΜΟΠΟΙΕΙΣΤΕ ΤΟΝ ΚΩΔΙΚΟ ΑΚΙΝΗΤΟΥ ΠΟΥ ΑΝΑΓΡΑΦΕΤΑΙ ΣΤΗΝ ΠΕΡΙΓΡΑΦΗ. Η ΔΙΕΥΘΥΝΣΗ ΣΤΟΝ ΧΑΡΤΗ ΕΧΕΙ ΤΟΠΟΘΕΤΗΘΕΙ ΚΑΤΑ ΠΡΟΣΕΓΓΙΣΗ. ΟΙ ΑΚΡΙΒΕΙΣ ΠΛΗΡΟΦΟΡΙΕΣ ΤΗΣ ΔΙΕΥΘΥΝΣΗΣ ΠΑΡΕΧΟΝΤΑΙ ΣΤΗΝ ΥΠΟΔΕΙΞΗ ΤΟΥ ΑΚΙΝΗΤΟΥ.
16,100483,residence,Πάτρα,rent,600,Διαμέρισμα 82 τ.μ.,πάνω από την μαρίνα της Πάτρας σε απόσταση 5 λεπτά από την μαρίνα και 10 λεπτά με τα πόδια από το κέντρο. Έχει 2 ευρύχωρα υπνοδωμάτια 1 μεγάλο σαλόνι 1 ξεχωριστή κουζίνα 1 μπάνιο 1 αποθήκη και πόρτα ασφαλείας είναι πλήρως ανακαινισμένο και μερικώς επιπλωμένο.
17,100339,residence,Πάτρα,rent,180,Διαμέρισμα 20 τ.μ.,Κωδ.: 87-2614 - ΠΡΟΣΦΥΓΙΚΑ - Πάτρα (Αχαΐα) - ΕΝΟΙΚΙΑΣΗ- Δυάρι (Κατοικίες) 2000 m² Υπνοδωμάτια: 1 Όροφος Ισόγειο Τύπος Θέρμανσης: Ατομική-Ηλεκτρικό  Έτος Κατασκευής: 2002 Πολύ Καλή Κατάσταση Φοιτητική Κατοικία- Κατάλληλη και για Εργαζόμενους Και Ζευγάρια. Προσόψεως Πολύ Φωτεινό Βαμμένο Πόρτα Ασφαλείας Κουφώματα Αλουμινίου Διπλά Τζάμια Σίτες Δάπεδο Πλακάκι Παράθυρο Στο Μπάνιο Πατάρι Αποθήκευσης Αυλή 10τμ. Στη Τιμή Του Ενοικίου Συμπεριλαμβάνεται Και Ο Λογαριασμός Του Νερού. Το Ακίνητο Βρίσκεται Σε Ήσυχη και Διαμορφωμένη Περιοχή. Κοντά στο κέντρο της πόλης. Δίπλα σε Στάση Λεωφορείου Αρτοποιεία Καταστήματα Εστίασης και Εμπορικά Super Market Φαρμακεία Σχολεία Γυμναστήρια Τράπεζες Ιατρεία Λοιπή Αγορά. Αποστάσεις: 1500μ από Πλατεία Γεωργίου Α (κέντρο Πάτρας) 1200μ από Πλατεία Υψηλών Αλωνιών 450μ Από Νοσοκομείο Αγίου Ανδρέα. Γι αυτή την αγγελία επικοινωνήστε στο τηλέφωνο 2613014674. Η πινέζα στον χάρτη έχει τοποθετηθεί κατά προσέγγιση για ευνόητους λόγους. Οι ακριβείς πληροφορίες της τοποθεσίας παρέχονται μετά την επιβεβαίωση της συνάντησης. Τιμή: 180 € Χωρίς Κοινόχρηστα Κωδικός: 87-2614 ΔΕΙΤΕ ΤΟ VIDEO
18,100382,residence,Πάτρα,rent,450,Μονοκατοικία 60 τ.μ.,Πάτρα  Περιοχή -Προάστιο: Κωδικός Ακινήτου: 1591 . Ενοικιάζεται ανακαινισμένη το 2020  διαμπερής   Μονοκατοικία συνολικού εμβαδού  60τ.μ.   σε 100τ.μ. οικόπεδο   προσόψεως με αυτόνομη θέρμανση πετρελαίου . Αποτελείται από 2 υπνοδωμάτια  1 κουζίνα  1 σαλόνι  και μπάνιο . Είναι επιπλωμένη  και  εξοπλισμένη  με ηλεκτρικές συσκευές  κατασκευασμένη το 1985  βαμμένη και διαθέτει  κουφώματα αλουμινίου με διπλά τζάμια  εξωτερική θέση στάθμευσης  κλιματισμό ψύξης - θέρμανσης  ενεργειακή κλάση Γ  δάπεδα από μωσαϊκό & ξύλο  καλωδιακή τηλεόραση και εξωτερκό διαμορφωμένο χώρο . Είναι ιδανική για φοιτητές ή οικογένειες ή εργαζόμενους χωρίς μηνιαία κοινόχρηστα και επιτρέπονται τα κατοικίδια. Τιμή 450€ | Κωδικός Ακινήτου: 1591   Κτηματομεσιτικές υπηρεσίες EF-HOME REAL ESTATE. Για την καλύτερη αναζήτηση και εύρεση του ακινήτου χρησιμοποιήστε τον τετραψήφιο κωδικό που αναγράφεται παραπάνω ή επισκεφτείται την ιστοσελίδα μας: ef-home .gr. Η Διεύθυνση στον χάρτη έχει τοποθετηθεί κατά προσέγγιση .   EF-HOME REAL ESTATE κτηματομεσιτικές υπηρεσίες. Τηλέφωνο επικοινωνίας : (+30 )2610272163 και (+30 )6986578259 .Mail: info@ef-home.gr.
19,100383,residence,Πάτρα,rent,400,Διαμέρισμα 60 τ.μ.,ΚΩΔΙΚΟΣ ΑΚΙΝΗΤΟΥ: 22761 | ΠΑΤΡΑ ΑΓΙΑ ΣΟΦΙΑ: ΕΝΟΙΚΙΑΖΕΤΑΙ ΔΙΑΜΠΕΡΕΣ ΓΩΝΙΑΚΟ ΔΙΑΜΕΡΙΣΜΑ 60Τ.Μ. ΣΤΟΝ 2 ΟΡΟΦΟ ΜΕ ΑΣΑΝΣΕΡ ΜΕ ΑΥΤΟΝΟΜΗ ΘΕΡΜΑΝΣΗ ΠΕΤΡΕΛΑΙΟΥ. ΑΠΟΤΕΛΕΙΤΑΙ ΑΠΟ 1 ΥΠΝΟΔΩΜΑΤΙΟ 1 ΚΟΥΖΙΝΑ 1 ΣΑΛΟΝΙ ΚΑΙ ΜΠΑΝΙΟ. ΕΙΝΑΙ ΚΑΤΑΣΚΕΥΑΣΜΕΝΟ ΤΟ 1996 ΒΑΜΜΕΝΟ ΚΑΙ ΔΙΑΘΕΤΕΙ ΩΡΑΙΑ ΘΕΑ ΚΟΥΦΩΜΑΤΑ ΑΛΟΥΜΙΝΙΟΥ ΠΟΡΤΑ ΑΣΦΑΛΕΙΑΣ ΔΑΠΕΔΑ ΑΠΟ ΠΛΑΚΑΚΙ. ΕΙΝΑΙ ΙΔΑΝΙΚΟ ΓΙΑ ΦΟΙΤΗΤΕΣ ΜΕ ΕΛΑΧΙΣΤΑ ΚΟΙΝΟΧΡΗΣΤΑ ΚΑΙ ΕΠΙΤΡΕΠΟΝΤΑΙ ΤΑ ΚΑΤΟΙΚΙΔΙΑ.     ΤΙΜΗ 400€ | ΚΩΔΙΚΟΣ ΑΚΙΝΗΤΟΥ: 22761 ΑΚΙΝΗΤΑ ΑΠΟΚΛΕΙΣΤΙΚΗΣ ΔΙΑΘΕΣΗΣ ΜΕ ΦΩΤΟΓΡΑΦΙΕΣ ΠΟΥ ΔΙΑΧΕΙΡΙΖΕΤΑΙ Η ΕΤΑΙΡΙΑ ΜΑΣ ΘΑ ΒΡΕΙΤΕ ΣΤΗΝ ΙΣΤΟΣΕΛΙΔΑ ΜΑΣ. WEBSITE: www.tzelirealestate.gr ΓΙΑ ΤΗΝ ΚΑΛΥΤΕΡΗ ΕΞΥΠΗΡΕΤΗΣΗ ΣΑΣ ΧΡΗΣΙΜΟΠΟΙΕΙΣΤΕ ΤΟΝ ΚΩΔΙΚΟ ΑΚΙΝΗΤΟΥ ΠΟΥ ΑΝΑΓΡΑΦΕΤΑΙ ΣΤΗΝ ΠΕΡΙΓΡΑΦΗ. Η ΔΙΕΥΘΥΝΣΗ ΣΤΟΝ ΧΑΡΤΗ ΕΧΕΙ ΤΟΠΟΘΕΤΗΘΕΙ ΚΑΤΑ ΠΡΟΣΕΓΓΙΣΗ. ΟΙ ΑΚΡΙΒΕΙΣ ΠΛΗΡΟΦΟΡΙΕΣ ΤΗΣ ΔΙΕΥΘΥΝΣΗΣ ΠΑΡΕΧΟΝΤΑΙ ΣΤΗΝ ΥΠΟΔΕΙΞΗ ΤΟΥ ΑΚΙΝΗΤΟΥ.
20,100027,residence,Πάτρα,rent,400,Διαμέρισμα 97 τ.μ.,Πάτρα Αγυιά νοικιάζεται διαμπερές διαμέρισμα ημιώροφου 97 τ.μ. Αποτελείται από ανακαινισμένη κουζίνα  μεγάλο καθιστικό τραπεζαρία με πρόσβαση στο μπαλκόνι δύο άνετα υπνοδωμάτια  μπάνιο με μπανιέρα W/C και αποθήκη. Διαθέτει νέα αλουμίνια με διπλά κρύσταλλα ανάκληση και σίτες . Επιπλέον πόρτα ασφαλείας  τέντες και A/C . Είναι σε πολύ καλή κατάσταση άμεσα κατοικήσιμο. Κατάλληλο για οικογένειες λόγο της θέσης του βρίσκεται κοντά σε σχολεία φροντιστήρια αθλητικές δραστηριότητες  καταστήματα S/M και στη Νοταρά κεντρικό δρόμο με πρόσβαση στην αστική συγκοινωνία και τον προαστιακό. Τιμή: 400€ Αξία Μεσιτική Ακινήτων Μαντζούνη Αριστέα Τηλ. Επικοινωνίας: 2610 340009 - 6979975760 e-mail: info@axiamesitiki.gr Κατά την υπόδειξη του ακινήτου είναι απαραίτητη η προσκόμιση της Αστυνομικής Ταυτότητας και το Α.Φ.Μ. σας σύμφωνα με τον Ν.4072/11-4-2012 Φ.Ε.Κ 86Α
21,100332,residence,Πάτρα,rent,230,Διαμέρισμα 60 τ.μ.,ΚΩΔΙΚΟΣ ΑΚΙΝΗΤΟΥ: 5304 | ΠΑΤΡΑ ΚΑΣΤΕΛΛΟΚΑΜΠΟΣ: ΕΝΟΙΚΙΑΖΕΤΑΙ ΝΕΟΔΜΗΤΟ ΔΙΑΜΕΡΙΣΜΑ 60Τ.Μ. ΣΕ ΗΜΙΥΠΟΓΕΙΟ ΜΕ ΑΥΤΟΝΟΜΗ ΘΕΡΜΑΝΣΗ ΡΕΥΜΑΤΟΣ. ΑΠΟΤΕΛΕΙΤΑΙ ΑΠΟ 1 ΥΠΝΟΔΩΜΑΤΙΟ 1 ΣΑΛΟΝΟΚΟΥΖΙΝΑ ΚΑΙ ΜΠΑΝΙΟ. ΕΙΝΑΙ ΚΑΤΑΣΚΕΥΑΣΜΕΝΟ ΤΟ 2022 ΒΑΜΜΕΝΟ ΚΑΙ ΔΙΑΘΕΤΕΙ ΩΡΑΙΑ ΘΕΑ ΚΟΥΦΩΜΑΤΑ ΑΛΟΥΜΙΝΙΟΥ ΜΕ ΔΙΠΛΑ ΤΖΑΜΙΑ ΠΟΡΤΑ ΑΣΦΑΛΕΙΑΣ ΚΛΙΜΑΤΙΣΜΟ ΕΝΕΡΓΕΙΑΚΗ ΚΛΑΣΗ B+ ΔΑΠΕΔΑ ΑΠΟ ΠΛΑΚΑΚΙ ΣΙΤΕΣ. ΕΙΝΑΙ ΙΔΑΝΙΚΟ ΓΙΑ ΦΟΙΤΗΤΕΣ Η ΕΡΓΑΖΟΜΕΝΟΥΣ ΧΩΡΙΣ ΜΗΝΙΑΙΑ ΚΟΙΝΟΧΡΗΣΤΑ. ΤΙΜΗ 230€   | ΚΩΔΙΚΟΣ ΑΚΙΝΗΤΟΥ: 5304 ΟΛΑ ΤΑ ΑΚΙΝΗΤΑ ΠΟΥ ΕΧΕΙ ΑΝΑΛΑΒΕΙ ΤΟ ΓΡΑΦΕΙΟ ΜΑΣ ΜΠΟΡΕΙΤΕ ΝΑ ΤΑ ΒΡΕΙΤΕ ΣΥΓΚΕΝΤΡΩΜΕΝΑ ΣΤΟ SITE ΜΑΣ: WWW.NUEVACASA.ESTATE Η ΚΟΥΚΚΙΔΑ ΣΤΟΥΣ ΧΑΡΤΕΣ ΤΟΠΟΘΕΤΕΙΤΑΙ ΚΑΤΑ ΠΡΟΣΕΓΓΙΣΗ Η ΑΚΡΙΒΗΣ ΔΙΕΥΘΥΝΣΗ ΤΟΥ ΑΚΙΝΗΤΟΥ ΔΙΝΕΤΑΙ ΚΑΤΟΠΙΝ ΥΠΟΓΡΑΦΗΣ ΤΗΣ ΕΝΤΟΛΗΣ ΥΠΟΔΕΙΞΕΩΣ ΑΥΤΟΥ ΜΕΣΙΤΙΚΟ ΓΡΑΦΕΙΟ «NUEVA CASA» ΔΙΕΥΘΥΝΣΗ: ΠΑΝΤΑΝΑΣΣΗΣ 53 ΠΑΤΡΑ WEBSITE: WWW.NUEVACASA.ESTATE E-MAIL: NUEVA_CASA@OUTLOOK.COM ΤΗΛ. ΕΠΙΚΟΙΝΩΝΙΑΣ: 2614 010 635 ΚΙΝΗΤΟ: 6909 569 549
